prodid,brand,name,size,current_price,full_price,raw_description
4930434,The Paw Grocer,Freeze Dried Salmon Belly With Fins Dog Treat,90g,6.5,13.0,THE PAW GROCER FREEZE DRIED SALMON BELLY WITH FINS DOG TREAT 90 GRAM
4930401,The Paw Grocer,Freeze Dried Chicken Necks Dog Treat,90g,6.5,13.0,THE PAW GROCER FREEZE DRIED CHICKEN NECKS DOG TREAT 90 GRAM
8029877,Breeders Choice,Cat Litter Paper,15L,21.5,0.0,BREEDERS CHOICE CAT LITTER PAPER 15 LITRE
7136180,Whiskas,Adult 1+ Years Wet Cat Food with Chicken Mince Can,400g,2.7,0.0,WHISKAS ADULT 1+ YEARS WET CAT FOOD WITH CHICKEN MINCE 400G CAN
6708710,Whiskas,Adult 1+ Years Wet Cat Food With Beef Mince Can,400g,2.7,0.0,WHISKAS ADULT 1+ YEARS WET CAT FOOD WITH BEEF MINCE 400G CAN
8104101,Whiskas,1+ Years Wet Cat Food Lamb Mince Can,400g,2.7,0.0,WHISKAS 1+ YEARS ADULT WET CAT FOOD LAMB MINCE 400G CAN
283550,Whiskas,1+ Years Wet Cat Food Ocean Fish Loaf Can,400g,2.7,0.0,WHISKAS 1+ YEARS ADULT WET CAT FOOD OCEAN FISH LOAF 400G CAN
5391787,Whiskas,1+ Years Wet Cat Food Tuna Can,400g,2.7,0.0,WHISKAS 1+ YEARS ADULT WET CAT FOOD TUNA LOAF 400G CAN
8567325,Peters,Pasture Hay Bedding And Food,1kg,10.0,0.0,PETER PASTURE HAY PET BEDDING AND FOOD 1KG
107514,Whiskas,1+ Years Jellymeat Loaf Wet Cat Food Can,400g,2.7,0.0,WHISKAS 1+ YEARS ADULT WET CAT FOOD JELLYMEAT LOAF 400G CAN
7847723,Optimum,Adult All Breed Dry Dog Food With Chicken- Vegetables & Rice,7kg,45.0,0.0,OPTIMUM ADULT ALL BREED DRY DOG FOOD WITH CHICKEN- VEGETABLES & RICE 7KG
1219284,Optimum,Adult All Breed Dry Dog Food With Beef Vegetables & Rice,7kg,45.0,0.0,OPTIMUM ADULT ALL BREED DRY DOG FOOD WITH BEEF- VEGETABLES & RICE 7KG
4467839,Optimum,Puppy Chicken Dry Dog Food,7kg,45.0,0.0,OPTIMUM DRY DOG FOOD PUPPY CHICKEN 7KG
9074968,Optimum,Adult Grain Free Dry Dog Food With Chicken & Vegetables,6.2kg,45.0,0.0,OPTIMUM ADULT GRAIN FREE DRY DOG FOOD WITH CHICKEN & VEGETABLES 6.2KG
6136311,Applaws,Taste Toppers Dog Tin Multipack Chicken Selection In Broth Dog Food 5x156g,5 pack,12.5,0.0,APPLAWS TASTE TOPPERS DOG TIN MULTIPACK CHICKEN SELECTION IN BROTH DOG FOOD 5X156G
6136300,Applaws,Taste Toppers Dog Tin Multipack Chicken Selection In Gravy Dog Food 5x156g,5 pack,12.5,0.0,APPLAWS TASTE TOPPERS DOG TIN MULTIPACK CHICKEN SELECTION IN GRAVY DOG FOOD 5X156G
6136322,Applaws,Taste Toppers Chicken Selection In Stew Dog Food Tin Multipack 5X156g,5 pack,12.5,0.0,APPLAWS TASTE TOPPERS DOG TIN MULTIPACK CHICKEN SELECTION IN STEW DOG FOOD 5X156G
3713893,Nood,Dry Dog Food Cage Free Chicken Recipe With Superfoods,7kg,35.0,42.0,NOOD CAGE-FREE CHICKEN RECIPE WITH SUPERFOODS DRY DOG FOOD 7KG
9113254,Natures Goodness,Complete Care Adult Dry Dog Food With Chicken,7kg,32.0,40.0,NATURES GOODNESS COMPLETE CARE ADULT DRY DOG FOOD WITH CHICKEN 7KG
9113265,Natures Goodness,Complete Care Adult Dry Dog Food With Lamb,7kg,32.0,40.0,NATURES GOODNESS COMPLETE CARE ADULT DRY DOG FOOD WITH LAMB 7KG
8811550,Breeders Choice,Cat Litter Paper,24L,25.0,30.0,BREEDERS CHOICE CAT LITTER PAPER 24L
3742280,World's Best,Clumping Formula Cat Litter,3.63 kg,22.0,26.0,WORLD'S BEST CAT LITTER CLUMPING FORMULA 3.63KG
3741505,Nature's Gift,Adult All Breeds Dry Dog Food With Beef,6kg,19.6,28.0,NATURE'S GIFT ADULT ALL BREEDS DRY DOG FOOD WITH BEEF 6KG
9205669,Friskies,Indoor Delight Dry Cat Food,700g,3.3,5.6,FRISKIES INDOOR DELIGHT DRY CAT FOOD 700 GRAM
3875137,Love'em,Grain Free Dog Treats Lamb Jerky With Rosemary Flavour,200g,5.6,7.0,LOVE 'EM GRAIN FREE DOG TREAT LAMB JERKY WITH ROSEMARY FLAVOUR 200 GRAM
3319610,Nature's Gift,Adult All Breeds Dry Dog Food With Kangaroo,6kg,19.6,28.0,NATURE'S GIFT ADULT ALL BREEDS DRY DOG FOOD WITH KANGAROO 6 KG
3834049,Purina,Total Care Cat Treatment Heartwormer All Wormer Flea Control,1 pack,18.4,23.0,PURINA TOTAL CARE HEARTWORMER ALLWORMER FLEA CONTROL CAT TREATMENT 1PACK
5486760,Supercoat,Senior With Fish Dry Dog Food,2.6kg,12.5,18.0,SUPERCOAT SMARTBLEND SENIOR WITH FISH DRY DOG FOOD 2.6KG
3588838,Fancy Feast,Inspirations Chicken Variety Cat Food 12x70g,12 pack,11.4,19.0,FANCY FEAST ADULT INSPIRATIONS CHICKEN VARIETY CAT FOOD 12X70GRAM
3454616,Vitapet,Chewz Chicken Wrapped Rawhide Sticks Dog Treat,18 pack,13.2,16.5,VITAPET CHICKEN WRAPPED RAWHIDE STICKS DOG TREAT 18 PACK
3588849,Purina,Inspirations Salmon & Tuna Cat Food 12x70g,12 pack,11.4,19.0,FANCY FEAST ADULT INSPIRATIONS SALMON & TUNA CAT FOOD 12X70G
3598955,Fancy Feast,Dry Cat Food Tuna Prawn Mackerel & Crab Flavour,1.4kg,13.3,19.0,FANCY FEAST DRY CAT FOOD TUNA PRAWN MACKEREL & CRAB FLAVOUR 1.4KG
1898288,Whiskas,Adult 1+ Years So Meaty Wet Cat Food with Meat Cuts In Gravy 12x85g Pouch,12 pack,11.6,14.5,WHISKAS ADULT 1+ YEARS SO MEATY WET CAT FOOD WITH MEAT CUTS IN GRAVY 12X85G POUCH
3767065,Whiskas,So Fishy Recipes Adult Wet Cat Food Seafood Servings In Jelly Pouches 12x85g,12 pack,11.6,14.5,WHISKAS SO FISHY RECIPES ADULT WET CAT FOOD SEAFOOD SERVINGS IN JELLY 12X85G POUCHES
3767076,Whiskas,1+ Years So Fishy Recipe Ocean Platter In Jelly Cat Food 85g,12 pack,11.6,14.5,WHISKAS SO FISHY RECIPES ADULT WET CAT FOOD OCEAN PLATTER IN JELLY 12X85G POUCHES
3875148,Love'em,Grain Free Dog Treats Beef Jerky With Tomato,200g,5.6,7.0,LOVE 'EM GRAIN FREE BEEF JERKY WITH TOMATO 200 GRAM
7531741,Pedigree,DentaStix Large Dog Treats Daily Oral Care Dental Chews,7 pack,5.6,7.0,PEDIGREE DENTASTIX LARGE DOG TREATS DAILY ORAL CARE DENTAL CHEWS 7 PACK
5486726,Supercoat,Adult With Beef Dry Dog Food,2.8kg,12.5,18.0,SUPERCOAT SMARTBLEND ADULT BEEF DRY DOG FOOD 2.8KG
5952079,Catlux,Light Clumping Cat Litter,6L,7.5,9.0,CATLUX LIGHT CLUMPING LITTER 6 LITRE
6719433,Bow Wow,Pig Ear Dog Treats,1 each,2.45,3.5,BOW WOW DOG TREAT PIG EAR 20G
1328439,Applaws,Tin Mp Cuisine Selection Cat Food 8x70g,8 pack,12.75,15.0,APPLAWS TIN MP CAT FOOD CUISINE SELECTION 8X70GRAM
3251561,Nature's Gift,Adult All Breeds Dry Dog Food With Kangaroo,2.5kg,10.5,15.0,NATURE'S GIFT ADULT ALL BREEDS DRY DOG FOOD WITH KANGAROO 2.5KG
5188273,Dine,Classic Collection Adult Wet Cat Food Fish Selection In Jelly 12x85g Pouches,12 pack,12.8,16.0,DINE CLASSIC COLLECTION ADULT WET CAT FOOD FISH SELECTION IN JELLY 12X85G POUCHES
1328440,Applaws,Tin Mp Fish Deluxe Selection Cat Food 8x70g,8 pack,12.75,15.0,APPLAWS TIN MP CAT FOOD FISH DELUXE SELECTION 8X70GRAM
6820368,Applaws,Tin Cat Food Chicken Selection Multipack 8x70g,8 pack,12.75,15.0,APPLAWS TIN MULTIPACK CAT FOOD CHICKEN SELECTION 8X70G
