prodid,brand,name,size,current_price,full_price,raw_description
3537098,Purina,Total Care Tasty All Wormer Small Dog Or Puppies Treatment,1 pack,14.0,0.0,PURINA TOTAL CARE TASTY ALLWORMER SMALL DOG OR PUPPIES TREATMENT 1 PACK
3566290,Temptations,Cat Treats Tasty Chicken Flavour,85g,5.5,0.0,TEMPTATIONS CAT TREATS TASTY CHICKEN FLAVOUR 85G
3566314,Temptations,Tantalising Turkey Flavour Cat Treats,85g,5.5,0.0,TEMPTATIONS CAT TREAT TANTALISING TURKEY 85G BAG
3566325,Temptations,Tempting Tuna Flavour Cat Treats,85g,5.5,0.0,TEMPTATIONS CAT TREATS TEMPTING TUNA 85G BAG
3586184,Dine,Daily Cat Food Meat Selection 14X85g,14 pack,16.0,0.0,DINE WET CAT FOOD MEAT SELECTION IN GRAVY 14X85G TRAYS
3586195,Dine,Daily Cat Food Fish Selection 85g,14 pack,16.0,0.0,DINE WET CAT FOOD FISH SELECTION IN SAUCE 14X85G TRAYS
3586231,Dine,Daily Cat Food Poultry Selection 14x85g,14 pack,16.0,0.0,DINE WET CAT FOOD POULTRY SELECTION SLICES 14X85G TRAYS
3595560,Ultimates Indulge,Responsibly Fished Tuna & Barramundi Cat Food Canned,85g,2.0,0.0,ULTIMATES INDULGE RESPONSIBLY FISHED TUNA & BARRAMUNDI CAT FOOD 85GRAM
3595571,Ultimates,Indulge Whitemeat Tuna With Fish Roe & Chicken Breast Adult Cat Food,85g,2.0,0.0,ULTIMATES INDULGE TUNA WITH FISH ROE & CHICKEN BREAST CAT FOOD 85GRAM
3595593,Ultimates Indulge,Whitemeat Tuna With Flaked Salmon,85g,2.0,0.0,ULTIMATES INDULGE WHITEMEAT TUNA WITH FLAKED SALMON CAT FOOD 85GRAM
3616048,Friskies,Dry Adult Surfin & Turfin Favourites Cat Food,2.5kg,13.9,0.0,FRISKIES ADULT SURFIN' & TURFIN' DRY CAT FOOD 2.5KG
3699817,Woofin Good,Chunks In Gravy Beef Liver & Veg Dog Food,400g,2.5,0.0,WOOFIN GOOD CHUNKS IN GRAVY BEEF LIVER & VEG DOG FOOD 400 GRAM
3699828,Woofin Good,Chunks In Gravy Chicken Pasta & Veg Dog Food,400g,2.5,0.0,WOOFIN GOOD CHUNKS IN GRAVY CHICKEN PASTA & VEG DOG FOOD 400 GRAM
3699839,Woofin Good,Chunks In Gravy Lamb Rice & Vegetables Dog Food,400g,2.5,0.0,WOOFIN GOOD CHUNKS IN GRAVY LAMB RICE & VEG DOG FOOD 400 GRAM
3699872,Woofin Good,Grainfree Chunks In Gravy Chicken & Vegetables Dog Food,400g,2.5,0.0,WOOFIN GOOD GRAINFREE CHUNKS IN GRAVY CHICKEN & VEGETABLES DOG FOOD 400 GRAM
3700326,Woofin Good,Chunks In Gravy Beef Rice & Veg Dog Food,720g,3.5,0.0,WOOFIN GOOD CHUNKS IN GRAVY BEEF RICE & VEG DOG FOOD 720 GRAM
3700337,Woofin Good,Chunks In Gravy Chicken Rice & Veg Dog Food,720g,3.5,0.0,WOOFIN GOOD CHUNKS IN GRAVY CHICKEN RICE & VEG DOG FOOD 720 GRAM
3702220,Woofin Good,Chunks In Jelly Mixed Selection Chicken Duck & Turkey Pouches Dog Food 12x100g,12 pack,14.0,0.0,WOOFIN GOOD CHUNKS IN JELLY MIXED SELECTION CHICKEN- DUCK & TURKEY POUCHES DOG FOOD 12X100G
3702310,Woofin Good,Chunks In Gravy Mixed Selection Beef Lamb & Pork Dog Food Pouches 12X100g,12 pack,14.0,0.0,WOOFIN GOOD CHUNKS IN GRAVY MIXED SELECTION BEEF- LAMB & PORK POUCHES DOG FOOD 12X100G
3702332,Woofin Good,Chunks In Gravy Mixed Selection Chicken- Duck & Turkey Pouches Dog Food 12x100g,12 pack,14.0,0.0,WOOFIN GOOD CHUNKS IN GRAVY MIXED SELECTION CHICKEN- DUCK & TURKEY POUCHES DOG FOOD 12X100G
3707733,Coles,Cat Food Pouch Fish Variety 12X85g,12 pack,5.5,0.0,COLES CAT FOOD POUCH FISH VARIETY 12X85G
3707744,Coles,Meat Variety Cat Food Pouch 12x85g,12 pack,5.5,0.0,COLES CAT FOOD POUCH MEAT VARIETY 12X85G
3707755,Coles,Cat Food Pouch Poultry Variety 12x85g,12 pack,5.5,0.0,COLES CAT FOOD POUCH POULTRY VARIETY 12X85G
3707879,Purr,Seafood Selection Cat Food 12x85g,12 pack,14.0,0.0,PURR CAT FOOD SEAFOOD SELECTION 12X85G
3712609,Woofin Good,Calming Dog Treat,150g,8.0,0.0,WOOFIN GOOD CALMING DOG TREAT 150 GRAM
3712610,Woofin Good,Joints Dog Treat,150g,8.0,0.0,WOOFIN GOOD JOINTS DOG TREAT 150 GRAM
3713805,Nood,Dry Dog Food Cage Free Chicken Recipe With Superfoods,3kg,23.0,0.0,NOOD CAGE-FREE CHICKEN RECIPE WITH SUPERFOODS DRY DOG FOOD 3KG
3715935,Woofin Good,Grainfree Chicken & Vegetables Dry Dog Food,2.5kg,19.0,0.0,WOOFIN GOOD GRAINFREE CHICKEN & VEGETABLES DRY DOG FOOD 2.5KG
3715946,Woofin Good,Puppy Chicken Rice & Vegetables Dry Dog Food,2.5kg,19.0,0.0,WOOFIN GOOD PUPPY CHICKEN RICE & VEGETABLES DRY DOG FOOD 2.5KG
3735014,Banquet,Dog Food Meat Beef,1.2kg,2.7,0.0,BANQUET DOG FOOD MEAT BEEF 1.2KG
3735036,Banquet,Dog Food Meat,700g,1.8,0.0,BANQUET DOG FOOD MEAT 700 GRAM
3741210,The Natural Paw Company,Tofu Cat Litter,2kg,13.5,0.0,THE NATURAL PAW COMPANY TOFU CAT LITTER 2KG
3741232,Vitapet,Duck Wrapped Rawhide Sticks Dog Treat,5 pack,5.5,0.0,VITAPET DUCK WRAPPED RAWHIDE STICKS DOG TREAT 5 PACK
3742188,Vitapet,Jerhigh Chicken With Bacon Dog Treats,400g,20.0,0.0,VITAPET JERHIGH DOG TREATS CHICKEN WITH BACON 400 GRAM
3742199,Vitapet,Jerhigh Milky Sticks With Real Chicken Dog Treats,400g,20.0,0.0,VITAPET JERHIGH DOG TREATS MILKY STICKS WITH REAL CHICKEN 400 GRAM
3742654,Schmackos,Strapz With Beef Dog Treats,1kg,24.0,0.0,SCHMACKOS STRAPZ DOG TREATS BEEF 1KG BAG
3742698,Schmackos,Strapz Dog Treats with Beef,200g,8.0,0.0,SCHMACKOS STRAPZ DOG TREATS WITH BEEF 200G
3742701,Schmackos,Strapz Dog Treats With Chicken,200g,8.0,0.0,SCHMACKOS STRAPZ DOG TREATS WITH CHICKEN 200G
3742712,Schmackos,Strapz With Liver Dog Treats,200g,8.0,0.0,SCHMACKOS STRAPZ DOG TREATS LIVER 200G BAG
3755816,Fancy Feast,Savory Centers Chicken Pate Cat Food,85g,2.6,0.0,FANCY FEAST SAVORY CENTERS CHICKEN PATE CAT FOOD 85G
3755827,Fancy Feast,Savory Centers Salmon Pate Cat Food,85g,2.6,0.0,FANCY FEAST SAVORY CENTERS SALMON PATE CAT FOOD 85G
3755838,Fancy Feast,Savory Centers Tuna Pate Cat Food,85g,,,FANCY FEAST SAVORY CENTERS TUNA PATE CAT FOOD 85G
3762560,Felix,Play Tubes Chicken And Liver Cat Treats,50g,3.5,0.0,FELIX PLAY TUBES CHICKEN AND LIVER CAT TREATS 50 GRAM
3762571,Felix,Play Tubes Tuna And Crab Cat Treats,50g,3.5,0.0,FELIX PLAY TUBES TUNA AND CRAB CAT TREATS 50 GRAM
3765026,Coles,Dog Training Pads 15pack,15 pack,12.0,0.0,COLES DOG TRAINING PADS 15PACK
3769311,Trill,Bird Seed Budgie Mix,1.8kg,6.0,0.0,TRILL DRY BIRD SEED FOOD BUDGERIGAR MIX 1.8KG BOX
3769344,Trill,Bird Seed Canary & Finch Mix,1.8Kg,6.0,0.0,TRILL DRY BIRD SEED FOOD CANARY & FINCH MIX 1.8KG BOX
3769377,Trill,Bird Seed Small Parrot Mix,1.8Kg,6.0,0.0,TRILL DRY BIRD SEED FOOD SMALL PARROT MIX 1.8KG BOX
