prodid,brand,name,size,current_price,full_price,raw_description
8871053,Wiltshire,Square 16cm Air Fryer Paper Liners,50 Pack,5.0,10.0,WILTSHIRE SQUARE 16CM AIR FRYER PAPER LINERS 50 PACK
8871177,Wiltshire,Square 20cm Air Fryer Paper Liners,50 Pack,6.0,12.0,WILTSHIRE SQUARE 20CM AIR FRYER PAPER LINERS 50 PACK
8872089,Danone,Activia Probiotics No Added Sugar Yoghurt Mango 4x125g,500g,4.5,5.75,DANONE ACTIVIA PROBIOTICS NO ADDED SUGAR YOGHURT MANGO 4X125G
8882560,Umamipapi,Chilli Egg Mayo,240mL,6.5,8.0,UMAMIPAPI CHILLI EGG MAYO 240ML
8882800,Baker's Craft,16 Hour Fermented Sourdough Crackers,100g,4.0,6.5,BAKER'S CRAFT 16 HOUR FERMENTED SOURDOUGH CRACKERS 100G
8882810,Baker's Craft,Cherry Creek Avocado Oil Crackers,100g,4.0,6.5,BAKER'S CRAFT CHERRY CREEK AVOCADO OIL CRACKERS 100G
8891607,Youfoodz,Fueld Chicken Satay Noodles,415g,10.8,12.0,YOUFOODZ FUELD CHICKEN SATAY NOODLES 415G
8918372,Leggo's,Stir Through Saucetomato Garlic Onion,350g,3.9,5.3,LEGGOS STIR THROUGH SAUCE TOMATO GARLIC ONION
8925072,Compeed,Blister Medium,5 pack,10.0,13.0,COMPEED BLISTER MEDIUM 5PK
8925163,Oakwood Shoe And Boot,Microfibre Cloth 20x20cm,1PACK,3.2,4.0,OAKWOOD SHOE AND BOOT MICROFIBRE CLOTH 20X20CM
8925185,Oakwood,Magic Eraser Spong,2PACK,3.2,4.0,OAKWOOD MAGIC ERASER SPONGE 2 PK
8925571,Rehydraid,Electrolyte Effervescent Tablets Apple Raspberry,40 Pack,15.0,24.4,REHYDRAID ELECTROLYTE EFFERVESCENT TABLETS APPLE RASPBERRY 40PK
8926406,Touchbio Home,Test Kit Uti,2PACK,14.0,16.0,TOUCHBIO HOME TEST KIT UTI 2PK
8926600,Lvl Up Everday Hydration,Mixed Berry 10pk,10PACK,11.0,15.0,LVL UP EVERDAY HYDRATION MIXED BERRY 10PK
8926621,Lvl Up Everday Hydration,Lemon Lime 10pk,10PACK,11.0,15.0,LVL UP EVERDAY HYDRATION LEMON LIME 10PK
8926632,Lvl Up Everday,Hydration Orange 10pk,10PACK,11.0,15.0,LVL UP EVERDAY HYDRATION ORANGE 10PK
8946210,Tunnock's,Caramel Milk Chocolate Wafers Biscuits 8 Pack,240g,6.0,7.0,TUNNOCKS WAFERS CARAMEL 8PK
8947858,Zafarelli,Spirali Pasta No 56,500g,1.6,2.0,ZAFARELLI PASTA:SPIRALI NO 56:.:500 GRAM
8949026,Golden Wok,Grandma'S Gyoza Pork,700g,9.0,11.0,GOLDEN WOK GRANDMA'S GYOZA PORK 700G
8949059,Golden Wok,Grandma's Chicken Gyozas,700g,9.0,11.0,GOLDEN WOK GRANDMA'S CHICKEN GYOZAS 700GRAM
8949558,Melrose Peak Hydrations,Blackberry Lemonade 180g,180GRAM,18.0,30.0,MELROSE PEAK HYDRATIONS BLACKBERRY LEMONADE 180G
8949580,Melrose Peak Hydration,Watermelon 180g,180GRAM,18.0,30.0,MELROSE PEAK HYDRATION WATERMELON 180G
8949605,Melrose Peak Hydrations,Orange 180g,180GRAM,18.0,30.0,MELROSE PEAK HYDRATIONS ORANGE 180G
8962501,Coles,Cafe Style Rocky Road Slice,235g,6.5,7.5,COLES CAFE STYLE ROCKY ROAD SLICE 235G
8962523,Coles,Cafe Style Cookie Caramel Slice,280g,6.5,7.5,COLES CAFE STYLE COOKIE CARAMEL SLICE 280G
8969602,Oxyshred,Ultra Energy Drink Lychee Burst,355mL,4.0,4.9,OXYSHRED ULTRA ENERGY DRINK LYCHEE BURST 355ML
9000032,Rani,Superior Veg Momos,350g,4.9,6.0,RANI SUPERIOR VEG MOMOS 350G
9024529,Flora,Block Salted,250GRAM,2.9,3.9,FLORA BLOCK SALTED 250G
9026105,Red Tractor,Farmers Market Super Seed Muesli,700g,7.0,10.0,RED TRACTOR FARMERS MARKET SUPER SEED MUESLI 700G
9026400,Red Tractor,Farmers Market Honey & Cinnamon Granola,700g,7.0,10.0,RED TRACTOR FARMERS MARKET HONEY & CINNAMON GRANOLA 700G
9037280,Simple,Micellar Water Boost Wipes,20 Pack,4.5,7.0,SIMPLE MICELLAR WATER BOOST WIPES 20PK
9038523,Kb's Thawed Seafood,Marinara Mix,PERKG,16.0,18.0,KB'S THAWED SEAFOOD MARINARA MIX
9039151,Mayver's,Lovli Spoon Smooth Peanut Butter,450g,5.5,7.0,MAYVER'S LOVLI SPOON SMOOTH PEANUT BUTTER 450G
9039162,Mayver's,Lovli Spoon Crunchy Peanut Butter,450g,5.5,7.0,MAYVER'S LOVLI SPOON CRUNCHY PEANUT BUTTER 450G
9052375,Don,Traditional Kabana,200g,5.4,6.0,DON TRADITIONAL KABANA 200G
9071212,Swizzles,Squshies Strawberry & Cream,140g,4.5,5.0,SWIZZELS SQUASHIES STRAWBERRY & CREAM 140G
9073160,Sara Lee,Bluey Muffin Blueberry Oat,4 Pack,3.85,5.5,SARA LEE BLUEY MUFFIN BLUEBERRY OAT 4PK
9073171,Sara Lee,Bluey Muffin Apple Cinnamon,4 Pack,3.85,5.5,SARA LEE BLUEY MUFFIN APPLE CINNAMON 4PK
9102509,Sunsilk,Shampoo Coconut Hydration,350mL,5.0,7.5,SUNSILK SHAMPOO COCONUT HYDRATION 350ML
9102531,Sunsilk,Conditioner Coconut Hydration,350mL,5.0,7.5,SUNSILK CONDITIONER COCONUT HYDRATION 350ML
9108924,Life Space,Gummies Probitoics Blueberry,50 Pack,16.75,0.0,LIFE SPACE GUMMIES PROBITOICS BLUEBERRY 50PK
9110551,Coco Earth,Powder Marine Collagen + Creatine,200g,18.0,36.0,COCO EARTH POWDER MARINE COLLAGEN + CREATINE 200G
9110562,Coco Earth,Powder Marine Collagen + Hair Skin Nails,200g,18.0,36.0,COCO EARTH POWDER MARINE COLLAGEN + HAIR SKIN NAILS 200G
9131846,Arnotts,Savoy Minis Crackers Sea Salt,170g,3.0,4.0,ARNOTTS SAVOY MINIS CRACKERS SEA SALT 170G
9131879,Arnotts,Savoy Minis Crackers Cheese & Garlic,170g,3.0,4.0,ARNOTTS SAVOY MINIS CRACKERS CHEESE & GARLIC 170G
9137503,Rosella,Condensed Creamy Chicken Soup,390g,1.9,2.8,ROSELLA CONDENSED CREAMY CHICKEN SOUP 390G
9137536,Rosella,Condensed French Onion Soup,390g,1.9,2.8,ROSELLA CONDENSED FRENCH ONION SOUP 390G
9137558,Rosella,Condensed Sweet Corn Soup,390g,1.9,2.8,ROSELLA CONDENSED SWEET CORN SOUP 390G
