prodid,brand,name,size,current_price,full_price,raw_description
1038508,Hell,Ice Coffee Double Espresso,250mL,2.5,3.9,HELL ICE COFFEE DOUBLE ESPRESSO 250ML
7738604,Gippsland Dairy,Crafted Yogurt Confit Strawberry & Vanilla Bean,150g,3.0,4.0,GIPPSLAND DAIRY CRAFTED YOGURT CONFIT STRAWBERRY & VANILLA BEAN 150G
9082489,La Famiglia,Stone Baked Garlic Ciabatta,330g,5.0,8.0,LA FAMIGLIA STONE BAKED GARLIC CIABATTA
2803811,Grove Juice,Signature Mandarin Juice Chilled,350mL,2.95,3.5,GROVE SIGNATURE MANDARIN 350ML
1435530,Tidbit Foods,Jamon Serrano,80g,4.8,5.8,TIDBIT JAMON SERRANO 80G
1988438,Kenilworth,Roast Garlic & Cracked Pepper Cheddar,165g,4.8,5.5,KENILWORTH CHEDDAR GARLIC & PEPPER 165G
4938425,Obela,Singles Tzatziki Classic 3x60g,180g,3.25,4.5,OBELA SINGLES TZATZIKI CLASSIC 3X60G 180G
1059279,Sunny Queen,Peeled Hard Boiled Eggs 2 Pack,85g,3.7,4.5,SUNNY QUEEN PEELED HARD BOILED EGGS 2PK 85G
6934800,Kroon,Smoked Cheese Wedge,150g,5.6,8.0,KROON SMOKED CHEESE WEDGE 150G
6284680,Don,Italian Style Shaved Salami,160g,5.0,6.6,DON ITALIAN STYLE SHAVED SALAMI 160G
7729986,Latina,Protein Pasta Chicken & Pesto,400g,6.5,9.0,LATINA PROTEIN PASTA CHICKEN & PESTO 400G
8067640,Wildly Good,Original Veggie Strips,200g,4.5,6.5,WILDLY GOOD ORIGINAL VEGGIE STRIPS 200G
8551777,Girgarre,Reserve Matured Organic Cheddar Block,250g,6.0,8.0,GIRGARRE RESERVE MATURED ORGANIC CHEDDAR BLOCK 250G
8562274,Cremeux,Shropshire Blue,100 GRAM,7.0,8.0,CREMEUX SHROPSHIRE BLUE 100G
9536258,Perfect Italiano Cheese,Perfect Bakes Lactose Free,250g,5.5,6.5,PERFECT ITALIANO CHEESE PERFECT BAKES LACTOSE FREE 250G
9990648,On The Menu,Fresh Napoli Sauce,425g,5.0,7.5,ON THE MENU FRESH NAPOLI SAUCE 425G
3246889,Danone,Yopro Banana Yoghurt,160g,2.4,3.0,DANONE YOPRO YOGHURT:BANANA:.:160 GRAM
3844520,Bio,Cheese Pizza Shred,200g,5.4,9.0,BIO CHEESE PIZZA SHRED 200G
9954622,Latina,Creamy Carbonara Pasta Sauce,250g,4.4,5.5,LATINA CREAMY CARBONARA PASTA SAUCE 250G
6767243,Wildly Good,Burgers Beetroot Black Bean,220g,5.8,6.5,WILDLY GOOD BURGERS BEETROOT BLACK BEAN 220G
3896931,Remedy,Kombucha Raspberry Lemonade,750mL,5.25,7.5,REMEDY KOMBUCHA RASPBERRY LEMONADE 750ML
3951359,Remedy,Kombucha Wild Berry,750mL,5.25,7.5,REMEDY KOMBUCHA WILD BERRY 750ML
4357230,Yogo,Chocolate Custard Pouch Choc Dessert Snack,120g,1.7,2.5,YOGO CHOCOLATE CUSTARD POUCH CHOC DESSERT SNACK
6580526,Mersey Valley,Club Vintage Dairy Extra Tasty Cheddar Cheese,180g,6.2,8.65,MERSEY VALLEY VINTAGE CLUB CHEDDAR DAIRY:EXTRA TASTY:.:180 GRAM
1018577,Dare,Charged Mocha,240mL,2.5,4.0,DARE CHARGED MOCHA LATTE ICED COFFEE 240ML
1108465,Provedore,Prosciutto Cotto,100g,4.5,5.0,PROVEDORE PROSCIUTTO COTTO 100G
1323694,Provedore,Prosciutto Crumb,150g,4.5,5.0,PROVEDORE PROSCIUTTO CRUMB 150G
3467902,Senza,Gluten Free Pizza Base,220g,4.0,5.0,SENZA GLUTEN FREE PIZZA BASE 220G
3516350,Vegie Delights,Plant Based Thick Bbq Sausages,300g,6.0,7.5,VEGIE DELIGHTS PLANT BASED THICK BBQ SAUSAGES 300G
3560453,Castello,Danish Blue Extra Creamy,100g,5.0,6.0,CASTELLO DANISH BLUE EXTRA CHEAMY 100G
7829244,The Juice Brothers,Tropical Juice,1L,4.0,5.0,THE JUICE BROTHERS TROPICAL JUICE 1L
8067468,Wildly Good,Biteables Cheese Cauli Poppers,210g,4.5,6.5,WILDLY GOOD BITEABLES CHEESE CAULI POPPERS 210G
1988460,Kenilworth,Cheddar Mango & Macadamia,165g,4.8,5.5,KENILWORTH CHEDDAR MANGO & MACADAMIA 165G
2746966,Remedy,Kombucha Ginger & Lemon,750mL,5.25,7.5,REMEDY KOMBUCHA:GINGER LEMON:.:750 ML
2882895,Obela,Classic To Go Smooth Hommus,125g,3.25,4.0,OBELA DIP HOMMUS TO GO 125G
4954487,Red Rock Deli,Dip Singles Caramelised French Onion 3x50g,150g,3.25,4.5,RED ROCK DELI DIP SINGLES CARAMELISED FRENCH ONION 3X50G 150G
7272993,Emma & Tom's,Juice Drink Straight OJ,350mL,3.7,4.2,EMMA & TOMS JUICE DRINK:STRAIGHT OJ:.:350 ML
7273023,Emma & Tom's,Juice Drink Green Power,350mL,3.7,4.2,EMMA AND TOM'S JUICE DRINK:GREEN POWER:.:350 ML
7738502,Gippsland Dairy,Crafted Yogurt Buttery Caramel,150g,3.0,4.0,GIPPSLAND DAIRY CRAFTED YOGURT BUTTERY CARAMEL 150G
3246856,Danone,Yopro Mango Yoghurt,160g,2.4,3.0,DANONE YOPRO YOGHURT:MANGO:.:160 GRAM
1988529,Kenilworth,Sweet Chilli Sour Cream & Bell Peppers Club Cheddar Cheese,165g,4.8,5.5,KENILWORH CHEDDAR SWEET CHILLI SOUR CREAM & BELL PEPPERS 165G
1988551,KCF,Lime & Cracked Pepper Club Cheddar,165g,4.8,5.5,KENILWORTH CHEDDAR LIME & CRACKED PEPPER
5788496,Remedy,Kombucha Organic Orange Squeeze,750mL,5.25,7.5,REMEDY KOMBUCHA ORGANIC ORANGE SQUEEZE 750ML
4930638,Australia's Own,Organic Oat Milk,1L,2.1,3.5,AUSTRALIA'S OWN ORGANIC OAT MILK 1L
1018067,Dare,Charged Strong Latte Iced Coffee,240mL,2.5,4.0,DARE CHARGED STRONG LATTE ICED COFFEE 240ML
1108432,Provedore,Buffalo Chicken,100g,4.5,5.0,PROVEDORE BUFFALO CHICKEN 100G
8879601,Beijing,Chilli Tofu Pieces,200g,4.5,5.2,BEIJING DY TOFU:CHILLI:.:200 GRAM
3454332,Mr D's,Blue Lemonade Drink,500mL,1.9,2.55,MR D'S BLUE LEMONADE DRINK 500ML
