prodid,brand,name,size,current_price,full_price,raw_description
3251415,Farmers Union,Greek Style Strawberry Yoghurt Pouch,130g,1.2,2.5,FARMERS UNION GREEK YOGHURT POUCH STRAWBERRY:.:130 GRAM
7670395,Tasmanian Heritage,Double Cream Brie,200g,5.9,11.95,TASMANIAN HERITAGE DOUBLE CREAM BRIE 200G
3305810,Farmers Union,Greek Style Mango Yoghurt Pouch,130g,1.2,2.5,FARMERS UNION GREEK YOGHURT POUCH 130G:MANGO:.:130 GRAM
3087060,Farmers Union,Greek Yoghurt Pouch Vanilla,130g,1.2,2.5,FARMERS UNION GREEK YOGHURT POUCH 130G:VANILLA
3306765,Farmers Union,Greek Style Passionfruit Yoghurt Pouch,130g,1.2,2.5,FARMERS UNION GREEK YOGHURT POUCH PASSIONFRUIT:.:130 GRAM
3830911,Farmers Union,Yoghurt Peach 130g,130g,1.2,2.5,FARMERS UNION YOGHURT PEACH 130G
7670410,Tasmanian Heritage,Camembert,200g,5.9,11.95,TASMANIAN HERITAGE CAMEMBERT 200G
6600805,Farmers Union,No Added Sugar Kids Yogurt Pouch Blueberry,130g,1.2,2.5,FARMERS UNION NAS KIDS YOGURT POUCH BLUEBERRY 130G
3087071,Farmers Union,Greek Style Natural Yoghurt Pouch,130g,1.2,2.5,FARMERS UNION GREEK STYLE YOGHURT POUCH  NATURAL YOGURT
6601309,Farmers Union,No Added Sugar Kids Yogurt Pouch Tropical,130g,1.2,2.5,FARMERS UNION NAS KIDS YOGURT POUCH TROPICAL130G
6600689,Farmers Union,No Added Sugar Kids Yogurt Pouch Strawberry,130g,1.2,2.5,FARMERS UNION NAS KIDS YOGURT POUCH STRAWBERRY 130G
7292254,Vitasoy,Uht Oat Milk,1L,1.65,3.3,VITASOY UHT OAT MILK 1 LITRE
2412734,Vitasoy,Unsweetened Almond Uht Milk,1L,1.65,3.3,VITASOY ALMOND UHT MILK:UNSWEETENED:.:1 LITRE
6600678,Farmers Union,No Added Sugar Kids Yogurt Pouch Vanilla,130g,1.2,2.5,FARMERS UNION NAS KIDS YOGURT POUCH VANILLA 130G
5051858,Latina,Fresh Beef Ravioli Pasta,375g,4.0,8.0,LATINA FRESH BEEF RAVIOLI PASTA 375G
6601310,Farmers Union,No Added Sugar Kids Yogurt Pouch Banana,130g,1.2,2.5,FARMERS UNION NAS KIDS YOGURT POUCH BANANA 130G
5310253,Gippsland Dairy,Strawberry Waffle Mix-Ins,140g,2.1,4.2,GIPPSLAND DAIRY STRAWBERRY WAFFLE MIX-INS 140G
5316464,Gippsland Dairy,Choc Fudge Honeycomb Mix-Ins,140g,2.1,4.2,GIPPSLAND DAIRY CHOC FUDGE HONEYCOMB MIX-INS140G
9957675,25 Degrees,South Australian Beef With Caramelsed Onion Ravioli,325g,4.5,9.0,25 DEGREES SOUTH AUSTRALIAN BEEF WITH CARAMELISED ONION RAVIOLI 325G
5051836,Latina,Fresh Veal Tortellini Pasta,375g,4.0,8.0,LATINA FRESH VEAL TORTELLINI PASTA 375G
6399591,25 Degrees South,Prosciutto & Ricotta Ravioli,325g,4.5,9.0,25 DEGREES SOUTH PROSCIUTTO & RICOTTA RAVIOLI 325G
5309662,Gippsland Dairy,Cookies & Cream Mix-Ins,140g,2.1,4.2,GIPPSLAND DAIRY COOKIES & CREAM MIX-INS 140G
4344497,Tamar Valley,The Creamery Yoghurt Strawberries & Cream,170g,1.5,3.0,TAMAR VALLEY THE CREAMERY YOGHURT STRAWBERRIES & CREAM 170G
8536999,Tamar Valley,Dairy The Creamery Yoghurt Affogato,170 GRAM,1.5,3.0,TAMAR VALLEY DAIRY THE CREAMERY YOGHURT AFFOGATO 170G
5152833,25 Degrees South,Baby Spinach And Fetta Ravioli Pasta,325g,4.5,9.0,25 DEGREES SOUTH BABY SPINACH AND FETTA RAVIOLI PASTA 325G
8419623,Gippsland Dairy,Lemon Meringue Mix-ins,140GRAM,2.1,4.2,GIPPSLAND DAIRY LEMON MERINGUE MIX -INS 140G
4274733,25 Degrees South,Native Pumpkin Ricotta Ravioli Pasta,325g,4.5,9.0,25 DEGREES SOUTH NATIVE PUMPKIN RICOTTA RAVIOLI PASTA 325G
4348400,Tamar Valley,The Creamery Yoghurt Mangoes & Cream,170g,1.5,3.0,TAMAR VALLEY THE CREAMERY YOGHURT MANGOES & CREAM 170G
5280232,Latina,Fresh Spinach & Ricotta Agnolotti Pasta,375g,4.0,8.0,LATINA FRESH SPINACH & RICOTTA AGNOLOTTI PASTA 375G
8419601,Gippsland Dairy,Custard Tart Mix-ins,140 GRAM,2.1,4.2,GIPPSLAND DAIRY CUSTARD TART MIX-INS 140G
4348421,Tamar Valley,The Creamery Yoghurt Blueberries & Cream,170g,1.5,3.0,TAMAR VALLEY THE CREAMERY YOGHURT BLUEBERRIES & CREAM 170G
7675173,Tamar Valley,The Creamery Yoghurt Vanilla Bean,170g,1.5,3.0,TAMAR VALLEY THE CREAMERY YOGHURT VANILLA BEAN 170G
1148084,Tamar Valley,The Creamery Yoghurt Salted Caramel,170g,1.5,3.0,TAMAR VALLEY THE CREAMERY YOGHURT SALTED CARAMEL 170G
1154586,Gippsland Dairy,Honey Praline Crunch Mix Ins,140g,2.1,4.2,GIPPSLAND DAIRY HONEY PRALINE CRUNCH MIX INS 140G
9435160,La Famiglia,Bread Slices Garlic 9 Pack,270g,4.0,6.5,LA FAMIGLIA 9PK BREAD SLICES:GARLIC:.:270 GRAM
5552263,La Famiglia,Just For 2 Cheesy Garlic Bread,190g,3.8,4.5,LA FAMIGLIA JUST FOR 2 CHEESY GARLIC BREAD 190G
9991287,On The Menu,Fresh Pasta Beef Ravioli,600g,8.0,11.0,ON THE MENU FRESH BEEF RAVIOLI 600G
9991390,On The Menu,Fresh Pasta Ricotta & Spinach Agnolotti,600g,8.0,11.0,ON THE MENU FRESH RICOTTA & SPINACH AGNOLOTTI 600G
9991298,On The Menu,Fresh Pasta Pesto & Ricotta Agnolotti,600g,8.0,11.0,ON THE MENU FRESH PESTO & RICOTTA AGNOLOTTI 600G
9991414,On The Menu,Fresh Pasta 4 Cheese & Cracked Pepper Ravioli,600g,8.0,11.0,ON THE MENU FRESH 4 CHEESE & CRACKED PEPPER RAVIOLI 600G
3089394,D'Argental,Washed Rind Brie,approx. 100g,6.22,8.3,D'ARGENTAL WASHED RIND BRIE (2X1.9KG)
7246880,Vaalia,Kids Strawberry Yoghurt Pouch,140g,2.5,0.0,VAALIA KIDS YOGHURT POUCH:STRAWBERRY:.:140 GRAM
3055086,Primo,Champagne Leg Ham,100g,3.95,0.0,PRIMO CHAMPAGNE LEG HAM 100GRAM
2819436,Primo,Gluten Free Thinly Sliced Double Smoked Leg Ham,100g,3.95,0.0,PRIMO DOUBLE SMOKED HAM 100G
8145856,Primo,English Sliced Ham,100g,3.95,0.0,PRIMO HAM:ENGLISH:.:100GRAM
9065548,Primo,Manuka Honey Leg Ham,100g,3.95,0.0,PRIMO MANUKA HONEY:LEG HAM:.:100 GRAM
2814024,Primo,Sliced Turkey Breast,80g,3.95,0.0,PRIMO SLICED TURKEY BREAST 80G
8670914,Yumi's,Traditional Hommus Dip Dairy & Gluten Free,200g,4.5,0.0,YUMIS TRADITIONAL HOMMUS DIP DAIRY & GLUTEN FREE 200G
