prodid,brand,name,size,current_price,full_price,raw_description
9131890,L'Oreal,Elvive Dream Long Conditioner,800mL,15.0,0,L'OREAL ELVIVE DREAM LONG CONDITIONER 800ML
9131904,L'Oreal,Elvive Extraordinary Oils Conditioner,800mL,15.0,0,L'OREAL ELVIVE EXTRAORDINARY OILS CONDITIONER 800ML
9131915,L'Oreal,Elvive Extraordinary Oils Conditioner,340mL,10.0,0,L'OREAL ELVIVE EXTRAORDINARY OILS CONDITIONER 340ML
9131926,L'Oreal,Elvive Extraordinary Oils Coconut Conditioner,340mL,10.0,0,L'OREAL ELVIVE EXTRAORDINARY OILS COCONUT CONDITIONER 340ML
9131937,L'Oreal,Elvive Hyaluron Plump Conditioner,800mL,16.0,0,L'OREAL ELVIVE HYALURON PLUMP CONDITIONER 800ML
9131948,L'Oreal,Elvive Hyaluron Plump Conditioner,340mL,11.0,0,L'OREAL ELVIVE HYALURON PLUMP CONDITIONER 340ML
9132339,L'Oreal,Elvive Total Repair Conditioner,340mL,10.0,0,L'OREAL ELVIVE TOTAL REPAIR S CONDITIONER 340ML
9132340,L'Oreal,Elvive Total Repair Conditioner,800mL,15.0,0,L'OREAL ELVIVE TOTAL REPAIR S CONDITIONER 800ML
9132394,L'Oreal,Elvive Total Repair Shampoo,340mL,10.0,0,L'OREAL ELVIVE TOTAL REPAIR S SHAMPOO 340ML
9132500,L'Oreal,Elvive Colour Protect Shampoo,340mL,10.0,0,L'OREAL ELVIVE COLOUR PROTECT SHAMPOO 340ML
9132598,L'Oreal,Elvive Colour Protect Shampoo,800mL,15.0,0,L'OREAL ELVIVE COLOUR PROTECT SHAMPOO 800ML
9132601,L'Oreal,Elvive Dream Long Shampoo,340mL,10.0,0,L'OREAL ELVIVE DREAM LONG SHAMPOO 340ML
9132871,Codral,Mucus Cough + Cold Liquid Raspberry Flavour,200mL,15.5,0,CODRAL MUCUS COUGH + COLD ORAL LIQUID 200ML
9133342,L'Oreal,Elvive Dream Long Shampoo,800mL,15.0,0,L'OREAL ELVIVE DREAM LONG SHAMPOO 800ML
9137263,L'Oreal,Elvive Extraordinary Oils Shampoo,340mL,10.0,0,L'OREAL ELVIVE EXTRAORDINARY OILS SHAMPOO 340ML
9137274,L'Oreal,Elvive Extraordinary Oils Shampoo,800mL,15.0,0,L'OREAL ELVIVE EXTRAORDINARY OILS SHAMPOO 800ML
9137300,L'Oreal,Elvive Extraordinary Oils Coconut Shampoo,340mL,10.0,0,L'OREAL ELVIVE EXTRAORDINARY OILS COCONUT SHAMPOO 340ML
9137343,L'Oreal,Elvive Hyaluron Plump Shampoo,800mL,16.0,0,L'OREAL ELVIVE HYALURON PLUMP SHAMPOO 800ML
9137365,L'Oreal,Elvive Hyaluron Plump Shampoo,340mL,11.0,0,L'OREAL ELVIVE HYALURON PLUMP SHAMPOO 340ML
9137376,L'Oreal,Elvive Total Repair Shampoo,800mL,15.0,0,L'OREAL ELVIVE TOTAL REPAIR S SHAMPOO 800ML
9137445,L'Oreal,Elvive Hyaluron Pure Serum,102mL,22.0,0,L'OREAL ELVIVE HYALURON PURE SERUM 102ML
9137467,Garnier,Fructis Damage Eraser Treatment,200mL,18.0,0,GARNIER FRUCTIS DAMAGE ERASER TREATMENT 200ML
9137478,L'Oreal,Elvive Growth Booster Conditioner,150mL,19.0,0,L'OREAL ELVIVE GROWTH BOOSTER CONDITIONER 150ML
9137514,L'Oreal,Elvive Growth Booster Serum,102mL,33.0,0,L'OREAL ELVIVE GROWTH BOOSTER SERUM 102ML
9137569,Garnier,Fructis Curls Method Pre Shampoo,200mL,18.0,0,GARNIER FRUCTIS CURLS METHOD PRE SHAMPOO 200ML
9137570,Garnier,Fructis Curls Method Shampoo,200mL,14.0,0,GARNIER FRUCTIS CURLS METHOD SHAMPOO 200ML
9137580,Garnier,Fructis Curls Method Hair Mask,370mL,16.0,0,GARNIER FRUCTIS CURLS METHOD HAIR MASK 370ML
9137591,Garnier,Fructis Curls Method Spray,150mL,18.0,0,GARNIER FRUCTIS CURLS METHOD SPRAY 150ML
9137627,Garnier,Fructis Damage Eraser Conditioner,315mL,8.0,0,GARNIER FRUCTIS DAMAGE ERASER CONDITIONER 315ML
9139870,L'Oreal,Elvive Growth Booster Shampoo,150mL,19.0,0,L'OREAL ELVIVE GROWTH BOOSTER SHAMPOO 150ML
9139939,OGX,Brazilian Keratin Mask,300mL,25.0,0,OGX BRAZILIAN KERATIN MASK 300ML
9139961,OGX,Bond Protein Shampoo,385mL,25.0,0,OGX BOND PROTEIN SHAMPOO 385ML
9140010,OGX,Bond Protein Conditioner,385mL,25.0,0,OGX BOND PROTEIN CONDITIONER 385ML
9140020,OGX,Bond Protein Sealing Serum,50mL,25.0,0,OGX BOND PROTEIN SEALING SERUM 50ML
9140031,OGX,Aom Weightless Oil Spray,118mL,30.0,0,OGX AOM WEIGHTLESS OIL SPRAY 118ML
9140053,OGX,Refreshing Rosemary Mint Shampoo,385 ML,23.0,0,OGX REFRESHING ROSEMARY MINT SHAMPOO 385ML
9140075,OGX,Refreshing Rosemary Mint Conditioner,385mL,23.0,0,OGX REFRESHING ROSEMARY MINT CONDITIONER 385ML
9152551,Neutrogena,T-Gel Shampoo,200mL,15.0,0,NEUTROGENA T-GEL SHAMPOO 200ML
9153612,Oral B,3d White Diamond Clean Clinical Whitening Toothpaste,94g,20.0,0,ORAL B 3D WHITE DIAMOND CLEAN CLINICAL WHITENING TOOTHPASTE 94 GRAM
9154557,Oral B,3d White Freshness Blast Clinical Whitening Toothpaste,94g,20.0,0,ORAL B 3D WHITE FRESHNESS BLAST CLINICAL WHITENING TOOTHPASTE 94 GRAM
9156257,Sensodyne,Repair & Protect Whitening Sensitive Toothpaste,100g,12.3,0,SENSODYNE REPAIR & PROTECT WHITENING SENSITIVE TOOTHPASTE 100G
9158570,Colgate,Total Battery Power Toothbrush,1 Pack,30.0,0,COLGATE TOTAL ACTIVE BATTERY POWER TOOTHBRUSH 1 PACK
9158580,Colgate,Toothbrush Kids Minecraft Battery Powered,1 Pack,12.0,0,COLGATE TOOTHBRUSH KIDS MINECRAFT BATTERY POWERED 1 PACK
9158693,Garnier,Fructis Damage Eraser Shampoo,315mL,8.0,0,GARNIER FRUCTIS DAMAGE ERASER SHAMPOO 315ML
9161439,Coco Earth,Gummies MCT,60 Pack,12.0,19,COCO EARTH GUMMIES MCT 60PK
9161450,Coco Earth,Powder Marine Collagen + Pre & Probiotics,200g,18.0,36,COCO EARTH POWDER MARINE COLLAGEN + PRE & PROBIOTICS 200G
9161461,Ostelin,Vitamin D Calcium Mini,250 Pack,32.5,0,OSTELIN VITAMIN D CALCIUM MINI 250PK
9187068,Gaviscon,Dual Action Liquid Peppermint,500mL,22.5,0,GAVISCON DUAL ACTION LIQUID PEPPERMINT 500ML
