prodid,brand,name,size,currentprice,fullprice,salespercentage,rawdescription
9164313,Leggos,Gourmet Rich Tomato Passata,690g,4.8,0,0,LEGGOS GOURMET RICH TOMATO PASSATA 690G
9164426,Raguletto,Tomato Paste,500g,3.0,0,0,RAGULETTO TOMATO PASTE 500G
9184897,Vittoria,Espresso Coffee Beans,1kg,56.0,0,0,VITTORIA COFFEE BEANS ESPRESSO 1KG
9185619,Queen,Colourful Letters And Numbers,50g,5.0,0,0,QUEEN COLOURFUL LETTERS AND NUMBERS 50G
9185620,Queen,Love Hearts,47g,5.0,0,0,QUEEN LOVE HEARTS 47G
9185630,Queen Choc,Flavoured Gold Pearls,36g,3.5,0,0,QUEEN CHOC FLAVOURED GOLD PEARLS 36GM
9185652,Queen,Dinosaur Cupcake Cases,48 Pack,2.8,0,0,QUEEN DINOSAUR CUPCAKE CASES 48PACK
9185663,Queen,Adventure Sprinkles Mix,90g,3.5,0,0,QUEEN ADVENTURE SPRINKLES MIX 90G
9185674,Queen,Dinosaur Icing Decorations,18g,3.5,0,0,QUEEN DINOSAUR ICING DECORATIONS 18G
9185947,Dollar Sweets,Barbie 4 Comp Sprinkles,155g,6.0,0,0,DOLLAR SWEETS BARBIE 4 COMP SPRINKLES 155G
9187217,Dollar Sweets,Hot Wheels 4 Comp Sprinkles,143g,6.0,0,0,DOLLAR SWEETS HOT WHEELS 4 COMP SPRINKLES 143G
9187240,Dollar Sweets,White Choc Melts Pot,230g,7.5,0,0,DOLLAR SWEETS WHITE CHOC MELT POT 230G
9187272,Dollar Sweets,Neon Food Colours 4 Pack,40mL,5.0,0,0,DOLLAR SWEETS NEON FOOD COLOURS 40ML 4PK
9190991,McKenzie's,Split Red Lentils,1kg,4.8,0,0,MCKENZIES LENTILS RED SPLIT
9191859,Coles,Bom Liquid Breakfast Chocolate 3x250mL,750mL,4.0,0,0,COLES BOM LIQUID BREAKFAST CHOCOLATE 3X250ML
9192319,Coles,Bom Liquid Breakfast Chocolate 6x250mL,1.5L,8.7,0,0,COLES BOM LIQUID BREAKFAST CHOCOLATE 6X250ML
9192603,Coles,Bom Liquid Breakfast Vanilla 3x250mL,750mL,4.0,0,0,COLES BOM LIQUID BREAKFAST VANILLA 3X250ML
9192614,Coles,Bom Liquid Breakfast Vanilla 6x250ml,1.5L,8.7,0,0,COLES BOM LIQUID BREAKFAST VANILLA 6X250ML
9192636,Coles,Bom Liquid Breakfast Strawberry 3x250ml,750mL,4.0,0,0,COLES BOM LIQUID BREAKFAST STRAWBERRY 3X250ML
9192647,Coles,Bom Liquid Breakfast Strawberry 6x250mL,1.5L,8.7,0,0,COLES BOM LIQUID BREAKFAST STRAWBERRY 6X250ML
9192658,Coles,Bom Liquid Breakfast Banana 3x250ml,750mL,4.0,0,0,COLES BOM LIQUID BREAKFAST BANANA 3X250ML
9192669,Coles,Bom Liquid Breakfast Banana 6x250ml,1.5L,8.7,0,0,COLES BOM LIQUID BREAKFAST BANANA 6X250ML
9194020,Carman's,Oat Cups Protein Porridge Creamy Honey 2 Pack,100g,6.5,0,0,CARMANS OAT CUPS PROTEIN PORRIDGE CREAMY HONEY 2PK 100G
9194030,Carman's,Oat Cups Protein Porridge Berry 2 Pack,100g,6.5,0,0,CARMANS OAT CUPS PROTEIN PORRIDGE BERRY 2PK 100G
9194074,Carman's,Protein Porridge Apple & Cranberry,270g,7.5,0,0,CARMANS PROTEIN RICH PORRIDGE APPLE & CRANBERRY 270G
9194802,Noshu,No Sugar Added Milk Choc Melts,140g,5.8,0,0,NOSHU NO SUGAR ADDED MILK CHOC MELTS 140G
9194846,Continental,Cup A Soup Thai Red Curry Serves 2,60g,2.8,0,0,CONTINENTAL CAS ASIAN SOUP Q2S:THAI RED CURRY:.:60 GRAM
9202172,Angas Park,Dried Apples,200g,6.0,0,0,ANGAS PARK APPLES DRIED
9209229,Campbell's,Real Stock Vegetable Stock Salt Reduced,1L,4.5,0,0,CAMPBELLS REAL STOCK:SALT REDUCED VEGETABLE:1 LITRE
9209230,Campbell's,Real Stock Beef Stock Salt Reduced,1L,4.5,0,0,CAMPBELLS REAL STOCK:SALT REDUCED BEEF:1 LITRE
9247578,Capilano,Pure Honey Squeeze,500g,8.6,0,0,CAPILANO PURE HONEY UPSIDE DOWN SQUEEZE
9266062,Suimin,K-Pow Noodle Bowl Cheesy Chicken,105g,4.0,0,0,SUIMIN K-POW NOODLE BOWL CHEESY CHICKEN 105G
9270558,Coles Perform,Clear Protein Raspberry Lemonade,310g,23.0,0,0,COLES PERFORM CLEAR PROTEIN RASPBERRY LEMONADE 310G
9270605,Coles Perform,Whey Protein Unflavoured,500g,28.0,0,0,COLES PERFORM WHEY PROTEIN UNFLAVOURED 500G
9287459,Bisto,Chicken Flavour Gravy Granules,170g,9.5,0,0,BISTO GRAVY GRANULES CHICKEN 170G
9287550,Bisto,Beef Gravy Granules,170g,9.5,0,0,BISTO BEEF GRAVY GRANULES 170G
9291004,Go Natural,Berry Frugos,210g,7.3,0,0,GO NATURAL FRUGO'S BERRY
9305277,Coles Simply,Breadcrumbs,500g,2.0,0,0,COLES SIMPLY BREADCRUMBS 500G
9307352,Dick Smith's,Bush Foods Breakfast Cereal,500g,5.5,0,0,FARMERS CO CEREAL BUSH FOOD BFAST
9311087,Patak's,Butter Chicken Curry Paste,312g,7.5,0,0,PATAKS BUTTER CHICKEN CURRY PASTE 312G
9315394,Nissin,Chicken Noodle Cup,73g,2.8,0,0,NISSIN NOODLE CUP CHICKEN 73G
9315747,Nissin,Laksa Flavour Instant Cup Noodles,75g,2.8,0,0,NISSIN NOODLE CUP LAKSA 75G
9316400,Nissin,Seafood Noodle Cup,72g,2.8,0,0,NISSIN NOODLE CUP:SEAFOOD:.:72 GRAM
9316422,Nissin,Tom Yam Seafood Noodle Cup,73g,2.8,0,0,NISSIN NOODLE CUP:TOM YAM SEAFOOD:.:73 GRAM
9316433,Nongshim,Shrimp Meat Chips,75g,2.9,0,0,NONGSHIM SHRIMP MEAT CHIPS 75G
9316488,Green's,Lemon Cake Mix,470g,3.8,0,0,GREENS LEMON CAKE MIX 470 GRAM
9325354,Maxines,Burn High Protein Bar Honeycomb Crunch,40g,3.3,0,0,MAXINES BURN HIGH PROTEIN BAR HONEYCOMB CRUNCH 40G
9325570,Uncle Tobys,Oats Quick Sachets Milo,280g,6.3,0,0,UNLCE TOBYS OATS QUICK SACHETS MILO 280G..
