prodid,brand,name,size,current_price,full_price,raw_description
2621789,Coles,Blackcurrant And Chia Bites,approx. 100g,3.0,0,COLES BLACKCURRANT AND CHIA BITES:.:PER KG
2674650,Coles Kitchen,Carrot & Broccoli Florets,150g,2.0,0,COLES KITCHEN CARROT & BROCCOLI FLORETS 150 GRAM
2679519,Coles Kitchen,Creme Royale Potato Mash,350g,5.5,0,COLES KITCHEN CREME ROYALE POTATO MASH 350 GRAM
2724760,Coles Organic,Baby Salad Leaves Lettuce Mix,100g,4.9,0,COLES ORGANIC LETTUCE:MIX:.:100 GRAM
2724828,Coles Organic,Rocket,100g,4.9,0,COLES ORGANIC:ROCKET:.:100 GRAM
2725922,Coles Organic,Baby Spinach,100g,4.8,0,COLES ORGANIC:BABY SPINACH:.:100 GRAM
2743866,Coles,Kestrel Potatoes,2 Kg,7.0,0,POTATO WASHED:KESTREL:.:2 KG
2786585,Coles Kitchen,Asian Style Salad Bowl,230g,5.5,0,COLES KITCHEN SALAD BOWL:ASIAN STYLE:.:230 GRAM
2786778,Coles Kitchen,Beetroot Slaw,200g,2.0,0,COLES KITCHEN BEETROOT SLAW:.:200 GRAM
2791406,Coles Kitchen,Coleslaw,200g,2.0,0,COLES KITCHEN COLESLAW:.:200 GRAM
2823342,Coles Organic,Medjool Dates,227g,7.5,0,ORGANIC DATES:MEDJOOL:.:227 GRAM
2829509,Coles,Portobello Brown Mushrooms,375g,9.5,0,COLES BROWN MUSHROOMS:PORTOBELLO:.:375 GRAM
2848387,Coles,Chai Chocolate Almonds,approx. 100g,3.5,0,COLES CHAI CHOCOLATE ALMONDS:.:PER KG
2848398,Coles,Passionfruit & Chia Seed Bites,approx. 100g,3.0,0,COLES PASSIONFRUIT AND CHIA SEED BITES:.:PER KG
2859066,Coles Kitchen,Australian Diced Butternut Pumpkin,500g,5.0,0,COLES KITCHEN AUSTRALIAN DICED BUTTERNUT PUMPKIN:.:500 GRAM
2985377,Coles Organic,Sweet Corn,3 Pack,8.5,0,COLES ORGANIC SWEET CORN:3 PACK
2997944,Gourmet Garden,Lightly Dried Basil,10g,4.0,0,HERB GG LIGHTLY DRIED :BASIL:.:10 GRAM
2997999,Gourmet Garden,Lightly Dried Mixed Herbs,8g,4.0,0,HERB GG LIGHTLY DRIED :MIXED:.:8 GRAM
2999258,Gourmet Garden,Lightly Dried Coriander,8g,4.0,0,HERB GG LIGHTLY DRIED:CORIANDER:.:8 GRAM
2999316,Gourmet Garden,Lightly Dried Chives,4g,4.0,0,HERB GG LIGHTLY DRIED CHIVES:.:4 GRAM
2999327,Gourmet Garden,Lightly Dried Parsley,8g,4.0,0,HERB GG LIGHTLY DRIED PARSLEY:.:8 GRAM
3014453,Coles Organic,Kale With Vegetables,200g,5.5,0,COLES ORGANIC VEGETABLES:KALE:.:200 GRAM
3014475,Coles Organic,Chopped Kale,140g,5.5,0,COLES ORGANIC KALE:CHOPPED:.:140 GRAM
3016120,Coles Kitchen,Superfood Slaw Mix,350g,4.0,0,COLES KITCHEN SUPERFOOD SLAW MIX:.:350 GRAM
3019876,Coles,Vegetable Chips,approx. 100g,3.5,0,COLES VEGGIE CHIPS:.:PER KG
3019912,Coles,Chocolate Coconut Rough,approx. 100g,3.5,0,COLES CHOCOLATE COCONUT ROUGH:.:PER KG
3019945,Coles,Dark Chocolate Ginger,approx. 100g,3.5,0,COLES DARK CHOCOLATE GINGER:.:PER KG
3019989,Coles,Chocolate Pretzels,approx. 100g,3.5,0,COLES CHOCOLATE PRETZELS:.:PER KG
3020026,Coles,Yoghurt Cranberry,approx. 100g,3.0,0,COLES YOGHURT CRANBERRIES:.:PER KG
3021889,Gourmet Garden,Basil Cold Blended Paste,80g,4.0,0,HERBS GG:BASIL:.:80 GRAM
3022167,Gourmet Garden,Garlic Cold Blended Paste,80g,4.0,0,HERBS GG:GARLIC:.:80 GRAM
3023206,Gourmet Garden,Ginger Cold Blended Paste,80g,4.0,0,HERBS GG:GINGER:.:80 GRAM
3023272,Gourmet Garden,Lemongrass Cold Blended Paste,80g,4.0,0,HERBS GG:LEMONGRASS:.:80 GRAM
3023308,Gourmet Garden,Mild Chilli Stir In Paste,80g,4.0,0,HERBS GG:CHILLI MILD:.:80 GRAM
3023625,Gourmet Garden,Coriander Cold Blended Paste,80g,4.0,0,HERBS GG:CORIANDER:.:80 GRAM
3026260,Coles,Spud Lite Baby Potato,750g,3.5,0,POTATO SPUDLITE PREPACK:BABY:.:750 GRAM
3026441,Coles,Spud Lite Potatoes,1.5 Kg,6.0,0,POTATO SPUDLITE :PREPACK:.:1.5 KG
3066275,Coles,Australian Baby Capsicums,350g,4.9,0,COLES AUSTRALIAN BABY CAPSICUMS 350 GRAM
3088176,Coles,Cocktail Truss Tomatoes,250g,4.5,0,COLES COCKTAIL TOMATOES:TRUSS:.:250 GRAM
3091556,Coles Organic,Continental Parsley,1 Each,4.5,0,COLES ORGANIC CONTINENTAL PARSLEY:1 BUNCH
3119043,Coles Organic,Kent Pumpkin,approx. 800g,4.64,0,COLES ORGANIC PUMPKIN:KENT:.:PER KG
3119190,Coles Organic,Butternut Pumpkin Cut,approx. 800g,4.72,0,COLES ORGANIC PUMPKIN:BUTTERNUT:.:PER KG
3137293,Coles,Superfood Mix,400g,10.0,0,COLES SUPERFOOD:MIX:.:400 GRAM
3198436,Coles,Kalettes Prepack,200g,4.5,0,KALETTES:PREPACK:.:200 GRAM
3198458,Coles,Peanut Butter Pretzels,approx. 100g,2.5,0,COLES PEANUT BUTTER PRETZELS:.:PER KG
3256849,Coles,Baby Beetroot Prepacked,250g,3.0,0,BEETROOT PREPACK:BABY:.:250 GRAM
3308498,Gourmet Garden,Garlic Cold Blende Paste Value Pack,120g,5.0,0,HERBS GG GARLIC VALUE PACK:.:120 GRAM
3308716,Coles,Butter Leaf Blend,120g,3.5,0,COLES BUTTER LEAF BLEND:.:120 GRAM
