prodid,brand,name,size,current_price,full_price,raw_description
6616860,Simply Wize,Gluten Free Puff Pastry Sheets,540g,11.0,0.0,SIMPLY WIZE GLUTEN FREE PUFF PASTRY SHEETS 540G
6617808,New Chinese Garden,Gluten Free Honey Chicken Kit,320g,12.95,0.0,NEW CHINESE GARDEN GLUTEN FREE HONEY CHICKEN KIT 320G
6617830,Mr Chen's,Gluten Free Prawn Hargow,204g,9.0,0.0,MR CHENS GLUTEN FREE PRAWN HARGOW 204G
6630395,Coles Perform,Lean Black Pepper Beef,330g,9.5,0.0,COLES PERFORM LEAN BLACK PEPPER BEEF 330G
6632528,Steggles,Chicken Fingers Original,400g,6.0,8.5,STEGGLES CHICKEN FINGERS:ORIGINAL:.:400GRAM
6758592,Streets,Paddle Pop Ice Confection Twister Mini Multi 6 Pack,300mL,7.0,8.0,STREETS PADDLE POP ICE CONFECTION TWISTER MINI MULTI 6PK
6774340,McCain,Frozen Healthy Choice Chicken Honey Stir Fry,330g,4.5,5.0,MCCAIN HEALTHY CHOICE PLUS MEAL FROZEN:HONEY STIR FRY CHICKEN:.:330 GRAM
6839468,McCain,Rustica Sourdough Salami & Leg Ham Pizza,430g,11.0,0.0,MCCAIN RUSTICA SOURDOUGH SALAMI & LEG HAM PIZZA 430G
6839515,McCain,Rustica Thin & Crispy Angus Beef,370g,11.0,0.0,MCCAIN RUSTICA THIN & CRISPY ANGUS BEEF 370G
6863815,Sara Lee,Frozen Sticky Date Pudding,475g,9.0,0.0,SARA LEE REGULAR PUDDING:STICKY DATE:.:475 GRAM
6868080,Patties,Frozen Party Sausage Rolls 12 Pack,450g,9.7,0.0,PATTIES 12PK FROZEN SAUSAGE ROLLS PARTY
6879123,Birds Eye,Thai Stir Fry Carrot Green Beans Broccoli Baby Corn & Bamboo Shoots Mix,500g,4.5,0.0,BIRDS EYE THAI STIR FRY CARROT GREEN BEANS BROCCOLI BABY CORN & BAMBOO SHOOTS MIX 500 GRAM
6943175,Tegel,Take Outs Louisiana Style Tenders,500g,14.0,0.0,TEGEL TAKE OUTS LOUISIANA STYLE TENDERS 500G
6943390,Steggles,Tempura Chicken Nuggets,1kg,13.5,0.0,STEGGLES TEMPURA CHICKEN NUGGETS 1KG
6943415,Steggles,Crumbed Chicken Alphabet Nugget,2kg,20.0,25.0,STEGGLES CRUMBED CHICKEN ALPHABET NUGGET 2KG
6957090,On The Menu,Frozen Chicken Fillet Burger,165g,4.9,0.0,ON THE MENU CHICKEN FILLET BURGER 165G
6970032,Chiko,Frozen Original Rolls 4 Pack,650g,6.0,7.5,EDGELL 4PK FROZEN CHIKO ROLLS
7010250,McCain,Frozen Bbq Meatlovers Family Pizza,500g,8.5,0.0,MCCAIN FAMILY FROZEN PIZZA:BBQ MEATLOVERS:.:500 GRAM
7020491,Violet Crumble,Ice Cream Sticks 4 Pack,360mL,10.0,0.0,VIOLET CRUMBLE ICE CREAM STICK 4PK 360ML
7027526,Destination Italy,Truffle & Mushroom Pizza,411g,11.0,0.0,DESTINATION ITALY MUSHROOM & TRUFFLE PIZZA 411G
7033926,Pasta Italia,Ricotta & Spinach Ravioli,400g,7.0,0.0,PASTA ITALIA RICOTTA & SPINACH RAVIOLI 400G
7033959,Pasta Italia,Pancetta & Smoked Mozzarella Ravioli,400g,7.0,0.0,PASTA ITALIA PANCETTA & SMOKED MOZZARELLA RAVIOLI 400G
7034099,Zooper Dooper,Cola 24x70ml,24 pack,7.2,0.0,ZOOPER DOOPER COLA 24X70ML
7035171,Super Nature,Wellness Burrito Bowl,350g,7.9,0.0,SUPER NATURE WELLNESS BURRITO BOWL 350G
7078607,Pana Organic,Vanilla Bean Frz Dessert,950mL,13.0,0.0,PANA ORGANIC VANILLA BEAN FRZ DESSERT 950ML
7082852,Peters,Skinny Cow Vanilla Caramel/double Choc Ice Cream Variety 4 Pack,640mL,7.0,0.0,PETERS SKINNY COW VANILLA CARAMEL/DOUBLE CHOC ICE CREAM VARIETY 4 PACK 640ML
7082863,Peters,Skinny Cow Vanilla Choc Sundae With Peanuts Ice Cream 4 Pack,640mL,7.0,0.0,PETERS SKINNY COW VANILLA CHOC SUNDAE WITH PEANUTS ICE CREAM 4PK 640ML
7082885,Peters,Original Twin Pole Lemon Lime Ice Blocks 8 Pack,544mL,8.0,0.0,PETERS ORIGINAL TWIN POLE LEMON LIME ICE BLOCKS 8 PACK 544ML
7084053,Mars,Bulk Ice Cream 18 Pack,891mL,17.3,0.0,MARS BULK ICE CREAM 18 PACK 891ML
7084111,Connoisseur,Laneway Sweets Triple Choc Cookie Ice Cream 4 Pack,360mL,12.0,0.0,CONNOISSEUR LANEWAY SWEETS TRIPLE CHOC COOKIE ICE CREAM 4 PACK 360ML
7105051,Peters,Drumstick Ice Cream Mega Pack Vanilla 16 Pack,1.9L,20.0,0.0,NESTLE DRUMSTICK ICE CREAM  MEGA PACK:VANILLA:.:1.9 LITRE
7108050,I&J,Frozen Barramundi,500g,19.0,0.0,I&J FROZEN BARRAMUNDI 500G
7108606,I&J,Frozen Snapper,500g,19.0,0.0,I&J FROZEN SNAPPER 500G
7108785,I&j,Frozen Basa Fillets,750g,10.0,0.0,I&J FROZEN BASA FILLETS 750G
7111338,KB's,Raw Prawns Tail On,1kg,38.0,0.0,KB'S RAW PRAWNS TAIL ON 1KG
7173776,Sealord,Southern Blue Whiting Bites,400g,9.0,0.0,SEALORD SOUTHERN BLUE WHITING BITES 400G
7202863,Coles,Irresistible Ice Cream Mini Almond 6 Pack,360mL,6.5,0.0,COLES IRRESISTIBLE ICE CREAM 6 PACK:MINI ALMOND:.:360 ML
7202874,Coles,Irresistible Ice Cream Mini Classic Vanilla 6 Pack,360mL,6.5,0.0,COLES IRRESISTIBLE ICE CREAM  MINI CLASSIC VANLLA 6 PACK 360 ML
7203017,Coles,Irresistible Almond Ice Cream 4 Pack,400mL,6.5,0.0,COLES IRRESISTIBLE ALMOND ICE CREAM 4 PACK.:400 ML
7203039,Coles,Irresistible Vanilla Ice Cream 4 Pack,400mL,6.5,0.0,COLES IRRESISTIBLE VANILLA ICE CREAM 4 PACK:.:400 ML
7206977,Peters,Light & Creamy Classic Vanlla Ice Cream,1.8L,6.5,0.0,PETERS LIGHT & CREAMY CLASSIC VANLLA ICE CREAM1.8L
7207018,Peters,Light & Creamy French Vanilla Ice Cream,1.8L,6.5,0.0,PETERS LIGHT & CREAMY FRENCH VANILLA ICE CREAM 1.8L
7207030,Peters,Light & Creamy Raspberry Ripple Ice Cream,1.8L,6.5,0.0,PETERS LIGHT & CREAMY RASPBERRY RIPPLE ICE CREAM 1.8L
7207051,Peters,Light & Creamy Choc Caramel & Vanilla Swirl Ice Cream,1.8L,6.5,0.0,PETERS LIGHT & CREAMY CHOC CARAMEL & VANILLA SWIRL ICE CREAM 1.8L
7207299,Birds Eye,Atlantic Salmon Fillet Natural,250g,14.0,0.0,BIRDS EYE ATLANTIC SALMON FILLET 250G
7207368,I&j,Original Fish Tenders,320g,8.0,0.0,I&J ORIGINAL FISH TENDERS 320G
7207380,I&j,Calamari,360g,8.0,0.0,I&J CALAMARI 360G
7207404,Birds Eye,Atlantic Salmon With Lemon Pepper,250g,14.0,0.0,BIRDS EYE ATLANTIC SALMON WITH LEMON PEPPER 250G
