prodid,brand,name,size,current_price,full_price,raw_description
1050365,Mayver's,Protein+ Smooth Vanilla Peanut Butter,375g,7.3,0.0,MAYVER'S SMOOTH VANILLA PROTEIN+ PEANUT BUTTER 375G
1051674,Lipton,Sachets Spiced Chai Latte,8 Pack,8.0,0.0,LIPTON SACHETS SPICED CHAI LATTE 8PK
1051685,Lipton,Sachets Classic Chai Latte,8 Pack,8.0,0.0,LIPTON SACHETS CLASSIC CHAI LATTE 8PK
1051743,Musashi,Fuel Pre Workout Zero Caffeine Red Raspberry,225g,45.0,0.0,MUSASHI FUEL PRE WORKOUT ZERO CAFFEINE RASBERRY 225G
1051970,Lavazza,Barista Intenso Ground Coffee,1kg,50.0,0.0,LAVAZZA BARISTA INTENSO GROUND COFFEE 1KG
105280,Continental,French Onion Salt Reduced Soup Serves 4,35g,1.2,0.0,CONTINENTAL PACKET SOUP:FRENCH ONION:SALT REDUCED:35 GRAM
1054446,Bega,Whipped Peanut Butter,375g,6.0,0.0,BEGA WHIPPED PEANUT BUTTER 375G
1054606,Mayver's,Chocolate Hazelnut Peanut Butter,280g,6.3,0.0,MAYVER'S CHOCOLATE HAZELNUT PEANUT BUTTER 280G
1055610,Sunrice,Yum Asian Style Chicken Instant Noodles,62g,3.0,0.0,SUNRICE YUM ASIAN STYLE CHICKEN INSTANT RICE NOODLES GLUTEN FREE 62 GRAM
1055620,Sunrice,Yum Asian Style Beef Flavour Instant Rice Noodles Gluten Free,62g,3.0,0.0,SUNRICE YUM ASIAN STYLE BEEF FLAVOUR INSTANT RICE NOODLES GLUTEN FREE 62 GRAM
1056190,Continental,Stock Pot Red Wine,104g,4.5,0.0,CONTINENTAL STOCK POT RED WINE 104 GRAM
1056281,Spanish,Tapas Dishes,2 Pack,10.0,0.0,WAGH BAKRI PREMIUM TEA 24X454GRAM
1058061,Masterfoods,H&s Garlic Powder Jar,45g,3.5,0.0,MASTERFOODS GARLIC POWDER 45G
1058072,Masterfoods,H&s Garlic Powder Jar,140g,6.5,0.0,MASTERFOODS GARLIC POWDER 140G
1058083,Masterfoods,H&s Paprika Ground Jar,33g,2.9,0.0,MASTERFOODS GROUND PAPRIKA 33G
1058094,Masterfoods,H&s Paprika Ground Jar,105g,6.8,0.0,MASTERFOODS GROUND PAPRIKA  105G
1068190,Pistabella,Pistachio Spread,200g,12.0,15.0,PISTABELLA PISTACHIO SPREAD 200G
1068360,Leggos,Pasta Sauce Carbonara Halal,490g,4.6,0.0,LEGGOS PASTA SAUCE CARBONARA HALAL 490G
10693,MasterFoods,Spaghetti Bolognese Herbs,40g,7.5,0.0,MASTERFOODS FAMILY SEASONING SPAG BOLOG BLND
1071503,Dolmio,Intensify Creamy Garlic & Black Pepper Pasta Sauce,395g,4.9,0.0,DOLMIO INTENSIFY CREAMY GARLIC & BLACK PEPPER PASTA SAUCE 395G
1071514,Dolmio,Intensify Parmesan- Sundried Tomato & Aromatic Herbs Pasta Sauce,395g,4.9,0.0,DOLMIO INTENSIFY PARMESAN - SUNDRIED TOMATO & AROMATIC HERBS PASTA SAUCE 395G
1071682,Dolmio,Intensify Creamy Truffle Flavour & Black Pepper Pasta Bake Sauce,390g,4.9,0.0,DOLMIO INTENSIFY CREAMY TRUFFLE FLAVOUR & BLACK PEPPER  PASTA BAKE SAUCE 390G
1072153,Dolmio,Intensify Roasted Garlic & Aromatic Herbs Pasta Bake Sauce,400g,4.9,0.0,DOLMIO INTENSIFY ROASTED GARLIC & AROMATIC HERBS PASTA BAKE SAUCE 400G
1074953,Coles,Medium Microwavable Brown Rice Cups,250g,2.2,0.0,COLES MEDIUM MICROWAVABLE BROWN RICE CUPS
1075107,Coles,Brown Rice,1 kg,2.5,0.0,COLES BROWN RICE 1KG
1079276,Betty Crocker,Bake Smart Cake Mix Gluten Free Devils Food,540g,8.0,0.0,BETTY CROCKER BAKE SMART GLUTEN FREE DEVILS FOOD CAKE 540G
1079287,Betty Crocker,Bake Smart Gluten Free Vanilla Cupcake,450g,8.0,0.0,BETTY CROCKER BAKE SMART GLUTEN FREE VANILLA CUPCAKE 450G
1083659,Sunrice Microwave,Teriyaki Rice Cup,250 GRAM,4.0,0.0,SUNRICE MICROWAVE FLAVOURED RICE CUP TERIYAKI 2 X 125_250G
1083717,Sungold,Indian Basmati Rice,5kg,30.0,0.0,SUNGOLD INDIAN BASMATI RICE 5KG
1087004,Nice Rice,Australian Arborio Rice,750 g,6.0,0.0,NICE RICE AUSTRALIAN ARBORIO RICE 750G
1092310,Coles,Mexican Hard Taco Shells,158g,3.5,0.0,COLES MEXICAN HARD TACO SHELLS 158G
1096640,Mayver's,Lovli Spoon No Sugar No Stir Smooth Peanut Butter,325g,4.5,5.5,MAYVER'S LOVLI SPOON NO SUGAR NO STIR SMOOTH PEANUT BUTTER 325G
1096650,Mayver's,Lovli Spoon No Sugar No Stir Crunchy Peanut Butter,325g,4.5,5.5,MAYVER'S LOVLI SPOON NO SUGAR NO STIR CRUNCHY PEANUT BUTTER 325G
1118039,Birch & Waite Sauce,Sweet & Spicy Seafood Marinade Sauce,100g,3.0,0.0,BIRCH & WAITE SWEET & SPICY SEAFOOD MARINADE & SAUCE 100G
1132685,Carman's,Light & Crispy Granola Honey Nut,400g,8.5,0.0,CARMANS LIGHT & CRISPY GRANOLA HONEY NUT 400G
1132812,Carman's,Light & Crispy Granola Raspberry & Vanilla,400g,8.5,0.0,CARMANS LIGHT & CRISPY GRANOLA RASPBERRY & VANILLA 400G
1133338,Red Tractor,High Protein Toasted Muesli Apricot - Almond - Coconut,750g,13.0,0.0,RED TRACTOR HIGH PROTEIN TOASTED MUESLI APRICOT- ALMOND- COCONUT 750G
1133360,Red Tractor,Low Sugar Protein Clusters Raspberry Macadamia,450g,9.0,0.0,RED TRACTOR LOW SUGAR PROTEIN CLUSTERS RASPBERRY MACADAMIA 450G
1135209,Sunsol,Low Sugar Toasted Muesli Apple Cinnamon,450g,8.0,0.0,SUNSOL LOW SUGAR TOASTED MUESLI APPLE CINNAMON 450G
1135297,Heritage Mill,Protein Clusters Honey Roasted Nut,650g,6.3,0.0,HERITAGE MILL PROTEIN CLUSTERS HONEY ROASTED NUT 650G
1135311,Heritage Mill,Light & Crispy Granola Vanilla Crumble,675g,6.3,0.0,HERITAGE MILL LIGHT & CRISPY GRANOLA VANILLA CRUMBLE 675G
1136846,Macadamias,Australia Roasted Salted,110g,9.5,0.0,MACADAMIAS AUSTRALIA 110G:ROASTED SALTED:.:110 GRAM
1136868,Macadamias,Australia Honey Roasted,110g,9.5,0.0,MACADAMIAS AUSTRALIA 110G:HONEY ROASTED:.:110 GRAM
1141562,The Spice Tailor,Satay Meal Kit,245g,6.7,0.0,THE SPICE TAILOR SATAY MEAL KIT 245G
1141609,The Spice Tailor,Kung Pao Meal Kit,245g,6.7,0.0,THE SPICE TAILOR KUNG PAO MEAL KIT 245G
1141675,Mr Chen's,Saucy Sesame Hand-pulled Style Noodle,320g,6.0,0.0,MR CHEN'S SAUCY SESAME HAND-PULLED STYLE NOODLE 320G
1141697,Mr Chen's,Saucy Soy & Spring Onion Hand Pulled Style Noodle,320g,6.0,0.0,MR CHEN'S SAUCY SOY & SPRING ONION HAND-PULLED STYLE NOODLE 320G
1142146,Sirena,Tuna Lite Chilli,185g,4.7,0.0,SIRENA TUNA LITE CHILLI 185G
