prodid,brand,name,size,current_price,full_price,raw_description
1477440,Wallaby,Bites Gluten Free Dark Chocolate Orange Almond & Coconut Yoghurt,150g,7.0,0,WALLABY BITES GLUTEN FREE DARK CHOCOLATE ORANGE ALMOND & COCONUT YOGHURT
1478544,Gullon,Sugar Free Chocolate Chip Cookies,125g,5.0,0,GULLON SUGAR FREE CHOC CHIP COOKIES 125G
1491338,UP&GO,Liquid Breakfast Banana 12 x 250ml,3L,17.5,0,SANITARIUM UP&GO LIQUID BREAKFAST FRIDGE PACK 12X250ML:BANANA:.:3 LITRE
1491360,UP&GO,Liquid Breakfast Strawberry 12 x 250ml,3L,17.5,0,SANITARIUM UP&GO LIQUID BREAKFAST FRIDGE PACK 12X250ML:STRAWBERRY:.:3 LITRE
149161,Sunbeam,Australian Lexia Raisins,375g,6.0,0,SUNBEAM AUSTRALIAN LEXIA RAISINS 375G
1498155,Cadbury,Double Decke Bar,54.5g,2.3,0,CADBURY DOUBLE DECKER BAR 54.5G
149886,Kellogg's,Corn Flakes Crumbs,300g,3.6,0,KELLOGGS CORNFLAKE CRUMBS 300G
1503754,Coles Finest,Balsamic Vinegar Of Modena,250mL,5.5,0,COLES FINEST BALSAMIC VINEGAR OF MODENA 250ML
1504167,Lee Kum Kee,Premium Soy Sauce,1.75L,9.5,0,LEE KUM KEE PREMIUM SOY SAUCE 1.75LT
152009,Uncle Tobys,Quick Oats Porridge,1kg,6.5,0,UNCLE TOBYS PORRIDGE OATS:QUICK:.1 KG
152020,Uncle Tobys,Quick Oats Porridge,500g,4.5,0,UNCLE TOBYS PORRIDGE QUICK OATS
153715,Saxa,White Pepper Shaker,50g,4.5,0,SAXA WHITE PEPPER SHAKER 50G
154693,Sunrice,Australian Medium Grain Brown Rice,1kg,4.5,0,SUNRICE AUSTRALIAN MEDIUM GRAIN BROWN RICE 1KG
1557491,Divella,Potato Gnocchi Di Patate,500g,3.7,0,DIVELLA GNOCCHI DI PATATE 500G
1566346,Guzzi's,Egg Pasta Fettuccine,500g,7.1,0,GUZZI'S EGG PASTA FETTUCCINE:.:500 GRAM
156688,Aristocrat,Red Cocktail Onions,150g,2.5,0,ROSELLA RED COCKTAIL ONIONS 150 GRAM
156983,Campbell's,Condensed Soup Can Vegetable Beef,420g,2.2,0,CAMPBELLS SOUP:VEG BEEF:.:420 GRAM
157079,Oxo,Beef Stock Cubes,71g,2.8,0,OXO 12PK STOCK CUBES:BEEF:.:71 GRAM
1573738,Indo Mie,Mi Goreng Hot & Spicy Instant 5 Pack,425g,3.95,0,INDO MIE MI GORENG HOT AND SPICY 5PK
1586117,San Remo,Spelt Spiral Pasta,250g,4.5,0,SAN REMO SPELT PASTA:SPIRALS:.:250 GRAM
1597714,Savour,Edamame Roasted & Salted Soy Beans,100g,2.2,0,SAVOUR EDAMAME ROASTED & SALTED SOYBEANS 100G
1597805,Coles,Diced Beetroot,425g,2.25,0,COLES DICED BEETROOT 425G
1597816,Coles,Sliced Beetroot,425g,1.9,0,COLES SLICED BEETROOT 425G
1597827,Coles,Sliced Beetroot,825g,3.25,0,COLES SLICED BEETROOT 825G
161644,Capilano,Pure Australian Honey Pail,1kg,14.0,0,CAPILANO PURE AUSTRALIAN HONEY PAIL 1KG
1616626,Maggi,2 Minute Instant Noodles Chicken Flavour 12 Pack,864g,9.0,0,MAGGI 2 MINUTE INSTANT NOODLES CHICKEN FLAVOUR 12 PACK
1616637,Maggi,2 Minute Beef Flavour Noodles 12 Pack,888g,9.0,0,MAGGI 2 MINUTE NOODLES BEEF FLAVOUR 12 PACK
1623472,UP&GO,Protein Energize Choc Hit 12 x 250ml,3L,17.5,0,SANITARIUM UP&GO LIQUID BREAKFAST FRIDGE PACK 12X250ML:ENERGIZE CHOCO:.:3 LITRE
162658,John West,Wild Alaskan Pink Salmon,105g,4.0,0,JOHN WEST SALMON PINK:REGULAR:.:105 GRAM
162749,Cornwell's,White Vinegar,2L,4.5,0,CORNWELLS WHITE VINEGAR
162760,Cornwell's,Brown Malt Vinegar,2L,4.5,0,CORNWELLS BROWN MALT VINEGAR
162862,White Wings,Hamburger Helper Seasoning Mix,110g,3.8,0,WHITE WINGS HAMBURGER HELPER 110G
163300,Edgell,Creamed Corn,420g,2.2,0,EDGELL CORN CREAMED 420G
1636124,Heilala,Vanilla Paste,65g,6.5,0,HEILALA VANILLA PASTE 65G
163650,MasterFoods,Chives Chopped,7g,5.8,0,MASTERFOODS FAMILY CHIVES FREEZE DRIED
163672,MasterFoods,Mixed Herbs,40g,5.8,0,MASTERFOODS FAMILY HERBS MIXED
163694,MasterFoods,Garlic Granules,155g,6.5,0,MASTERFOODS SPICE FAMILY GARLIC GRANULES
163923,MasterFoods,Lemon Pepper Seasoning,52g,3.5,4,MASTERFOODS LEMON PEPPER SEASONING
164245,Hoyts,Hot Peppers,430g,3.3,0,HOYTS PEPPERS HOT
164370,Yeo's Malaysian Curry,Sauce Canned Mild,400mL,4.2,0,YEO'S MALAYSIAN CURRY SAUCE CANNED MILD 400ML
165022,Keens,Curry Powder,120g,5.5,0,KEENS CURRY POWDER
1655570,Cadbury,Wispa Chocolate Bar,36g,2.3,0,CADBURY WISPA BAR 36G
166080,Angas Park,Australian Pitted Prunes,250g,5.9,0,ANGAS PARK AUSTRALIAN PITTED PRUNES 250G
167141,Sunbeam,Australian Sultanas,375g,5.0,0,SUNBEAM AUSTRALIAN SULTANAS 375G
168563,SPC,Canned Baked Beans,425g,2.5,0,SPC CANNED BAKED BEANS
168789,Spring Gully,Gherkins Rounds,550g,5.0,0,SPRING GULLY GHERKIN ROUNDS 550GRAM
168803,Spring Gully,Gluten Free Sweet Spiced Gherkins,550g,5.0,0,SPRING GULLY GHERKINS SWEET SPICED
169012,Praise,Traditional Mayonnaise,700g,6.0,0,PRAISE MAYONNAISE:TRADITIONAL:.:700GRAM
