prodid,brand,name,size,current_price,full_price,raw_description
3130206,Coles I'm Free From,Chocmint Creme Biscuits,145g,3.8,0.0,COLES I'M FREE FROM CHOCMINT CREME BISCUITS:145GRAM
3131071,Coles,Wellness Road Organic Maca Powder,150g,4.5,0.0,COLES WELLNESS ROAD ORGANIC MACA POWDER 150G
3131093,Coles Organic,Unrefined Extra Virgin Coconut Oil,900g,12.0,0.0,COLES ORGANIC EXTRA VIRGIN COCONUT OIL UNREFINED::900G
3131107,Coles,Wellness Road Organic Psyllium Husk,250g,7.0,0.0,COLES WELLNESS ROAD ORGANIC PSYLLIUM HUSK 250G
3131242,Coles,Wellness Road Xanthan Gum,100g,5.5,0.0,COLES WELLNESS ROAD XANTHAN GUM 100G
3131253,Wellness Road,Nutritional Yeast Flakes,200g,8.0,0.0,WELLNESS ROAD NUTRITIONAL YEAST FLAKES:200G
3132198,Cellucor,C4 Sport Blue Raspberry,285g,45.0,0.0,CELLUCOR C4 SPORT BLUE RASPBERRY 285G
3132256,Cellucor,C4 Sport Watermelon,285g,45.0,0.0,CELLUCOR C4 SPORT WATERMELON 285G
3133044,Coles I'm Free From,Crunchy Crumb,300g,4.25,0.0,COLES I'M FREE FROM CRNCHY CRUMB 300G
313367,Capilano,Pure Honey,500g,8.6,0.0,CAPILANO PURE HONEY
3134182,Kapai Puku Gut Health,Tropical Seed Mix,450 GRAM,17.0,0.0,KAPAI PUKU GUT HEALTH TROPICAL SEED MIX 450 GRAM
3134193,Kapai Puku,Gut Health Cacao Seed Mix,450g,17.0,0.0,KAPAI PUKU GUT HEALTH CACAO SEED MIX 450G
3134207,Kapai Puku,Gut Health Raw Seed Mix,450g,17.0,0.0,KAPAI PUKU GUT HEALTH RAW SEED MIX 450G
3134240,Kapai Puku,Gut Health Original Seed,450g,17.0,0.0,KAPAI PUKU GUT HEALTH ORIGINAL SEED 450G
3134706,Sweet William,Dairy Free Choc Baking Buttons,300g,6.9,0.0,SWEET WILLIAM DAIRY FREE CHOC BAKING BUTTONS 300 GRAM
3139426,Bragg,Nutritional Yeast Seasoning,127g,16.5,0.0,BRAGG SEASONING NUTRITIONAL YEAST PREMIUM QUALITY:: 127G
3139823,Coles,Wellness Road Organic White Quinoa,1kg,11.5,0.0,COLES WELLNESS ROAD ORGANIC WHITE QUINOA 1KG
314348,Angas Park,Dried Fancy Prunes,1kg,9.0,0.0,ANGAS PARK WHOLE AUSTRALIAN PRUNES 1KG
3145123,Red Tractor,Hulled Hemp Seeds,200g,11.0,0.0,RED TRACTOR AUSTRALIAN HULLED HEMP SEEDS 200G
3147640,Nongshim,Gourmet Spicy Shin Cup Noodle Soup,68g,2.5,0.0,NONGSHIM GOURMET SPICY SHIN CUP NOODLE SOUP 68G
3148686,Musashi,High Protein Shake Iced Chocolate,375mL,5.5,0.0,MUSASHI HIGH PROTEIN SHAKE ICED CHOCOLATE 375ML
3148722,Musashi,High Protein Shake Vanilla,375mL,5.5,0.0,MUSASHI HIGH PROTEIN SHAKE VANILLA 375ML
3151895,Beerenberg,Sweet Mustard Pickle,265g,6.3,0.0,BEERENBERG SWEET MUSTARD PICKLE 265G
3155874,Coles,American Style Barbeque Sauce,500mL,3.0,0.0,COLES AMERICAN STYLE BARBEQUE SAUCE 500ML
315668,MasterFoods,Thyme Leaves,10g,2.7,0.0,MASTERFOODS REGULAR THYME LEAVES
316150,MasterFoods,All Purpose Seasoning,65g,3.0,0.0,MASTERFOODS ALL PURPOSE SEASONING
316310,MasterFoods,All Spice Ground,30g,3.5,0.0,MASTERFOODS ALLSPICE GROUND 30G
316321,MasterFoods,Whole Cloves,20g,5.0,0.0,MASTERFOODS CLOVES WHOLE
316376,MasterFoods,Mixed Spice,30g,3.5,0.0,MASTERFOODS MIXED SPICE
3164398,Glico Pocky,Cookies & Cream Biscuit Sticks,40g,2.2,0.0,POCKY COOKIES & CREAM BISCUIT STICKS
317007,MasterFoods,Lemon Pepper Seasoning,170g,6.8,0.0,MASTERFOODS FAMILY SEASONING LEMON PEPPER
317029,Masterfoods,Italian Herbs,10g,2.7,0.0,MASTERFOODS ITALIAN HERBS
318021,Hoyts,Chilli Powder,50g,2.0,0.0,HOYTS CHILLI POWDER
318214,Hoyts,Whole Black Pepper,100g,5.0,0.0,HOYTS WHOLE BLACK PEPPER
318316,MasterFoods,Onion Salt Seasoning,68g,3.0,0.0,MASTERFOODS ONION SALT
318451,MasterFoods,Basil Leaves,10g,2.7,0.0,MASTERFOODS BASIL LEAVES
318462,MasterFoods,Celery Salt,57g,3.0,0.0,MASTERFOODS CELERY SALT
318473,MasterFoods,Vanilla Sugar,65g,2.9,0.0,MASTERFOODS REGULAR VANILLA SUGAR
318495,MasterFoods,Ground Cinnamon,28g,2.9,0.0,MASTERFOODS CINNAMON GROUND
3185015,Coles,Pure Australian Honey Squeeze,1kg,12.5,0.0,COLES PURE AUSTRALIAN HONEY SQUEEZE 1KG
3185296,Red Tractor,Organic Rolled Oats,1kg,8.0,0.0,RED TRACTOR ORGANIC ROLLED OATS 1KG
3185300,Red Tractor,Organic Instant Oats,1kg,8.0,0.0,RED TRACTOR ORGANIC INSTANT OATS 1KG
318531,MasterFoods,Chinese Five Spice,30g,3.5,0.0,MASTERFOODS CHINESE FIVE SPICE
3185310,Red Tractor,Australian Rolled Oats,1kg,6.0,0.0,RED TRACTOR AUSTRALIAN ROLLED OATS 1KG
3185321,Red Tractor,Australian Instant Oats,1kg,6.0,0.0,RED TRACTOR AUSTRALIAN INSTANT OATS 1KG
318553,MasterFoods,Ground Hot Chillies,27g,3.5,0.0,MASTERFOODS CHILLIES GROUND HOT
3185660,Edgell,Australian Grown Diced Beetroot,425g,2.7,0.0,EDGELL AUSTRALIAN GROWN DICED BEETROOT 425G
3185718,Edgell,Mexican Mix With Black Beans Pinto Beans And Red Kidney Beans,400g,1.8,2.2,EDGELL MEXICAN MIX WITH BLACK BEANS- PINTO BEANS AND RED KIDNEY BEANS 400G
