prodid,brand,name,size,current_price,full_price,raw_description
3729394,Coles,Premium Red Wine Jus,200mL,4.0,0.0,COLES PREMIUM RED WINE JUS 200ML
3729408,Coles,Premium Mushroom Sauce,200mL,4.0,0.0,COLES PREMIUM MUSHROOM SAUCE 200ML
3729430,Coles,Premium Peppercorn Sauce,200mL,4.0,0.0,COLES PREMIUM PEPPERCORN SAUCE 200ML
3730178,Aeroplane,Mousse Chocolate,65g,2.5,0.0,AEROPLANE MOUSSE CHOCOLATE 65G
373405,Coles,Australian Peach Slices In Juice,825g,3.0,0.0,COLES AUSTRALIAN PEACH SLICES IN JUICE
3735615,Coles Asia,Sesame Oil,370mL,8.6,0.0,COLES ASIA SESAME OIL 370ML
3735626,Coles Asia,Nori 10 Sheets,28g,3.7,0.0,COLES ASIA NORI SHEETS 28G
3735637,Coles Asia,Egg Noodles Thin,340g,2.15,0.0,COLES ASIA EGG NOODLES THIN 340G
3735648,Coles Asia,Egg Noodles Thick,340g,2.15,0.0,COLES ASIA EGG NOODLES THICK 340G
3735660,Coles Asia,Vermicelli Rice Noodles,340g,2.15,0.0,COLES ASIA VERMICELLI RICE NOODLES 340G
3735670,Coles Asia,Panko Crumbs,250g,,,COLES ASIA PANKO CRUMBS 250G
3735830,The Spice Tailor,Indonesian Rendang Curry,275g,6.7,0.0,THE SPICE TAILOR INDONESIAN RENDANG CURRY KIT 275G
3735841,The Spice Tailor,Thai Red Curry,275g,6.7,0.0,THE SPICE TAILOR THAI RED CURRY 275G
3735852,The Spice Tailor,Thai Green Curry,275g,6.7,0.0,THE SPICE TAILOR THAI GREEN CURRY 275G
3736425,Olympian,Continental Rusk,250g,6.0,0.0,OLYMPIAN CONTINENTAL RUSK 250G
3736447,Olympian,Olive Oil Rusk,260g,6.6,0.0,OLYMPIAN OLIVE OIL RUSK 260G
3736833,Wei Lih Ichiban,Noodle Bowl Roast Beef,150g,5.75,0.0,WEI LIH ICHIBAN BOWL NOODLE ROAST BEEF 150G
3736844,Wei Lih Ichiban,Noodle Bowl Roast Pork,150g,5.75,0.0,WEI LIH ICHIBAN NOODLE BOWL ROAST PORK 150G
3736924,Double,Phoenix Vermicelli Bean,200g,1.85,0.0,DOUBLE PHOENIX VERMICELLI BEAN 200G
3736935,Dragon,Glutinous Rice,1kg,5.0,0.0,DRAGON GLUTINOUS RICE 1KG
3736957,Kewpie,Mayonnaise 50% Reduced Fat,300g,5.5,0.0,KEWPIE MAYONNAISE 50% REDUCED FAT 300G
3736979,Kewpie,Mayonnaise Yuzu Flavour,300g,5.5,0.0,KEWPIE MAYONNAISE YUZU FLAVOUR 300G
3736990,Lee Kum Kee,Gluten Free Soya Sauce,250mL,4.3,0.0,LEE KUM KEE GLUTEN FREE SOYA SAUCE 250ML
3737020,Lee Kum Kee,Premium Dark Soy Sauce,250mL,3.6,0.0,LEE KUM KEE PREMIUM DARK SOY SAUCE 250ML
3737042,Lee Kum Kee,Ready Sauce San Choy Bao,100g,2.7,0.0,LKK READY SAUCE FOR SAN CHOY BAO 100G
3737075,Lee Kum Kee,Teriyaki Stir Fry Sauce,250g,4.4,0.0,LKK TERIYAKI STIR FRY SAUCE 250G
3737086,Lee Kum Kee,Vegetarian Stir Fry Sauce,255g,4.4,0.0,LKK VEGETARIAN STIR FRY SAUCE 255G
3737280,Taokaenoi,Crispy Seaweed Sour Cream & Onion,32g,3.3,0.0,TAOKAENOI CRISPY SEAWEED SOUR CREAM & ONION 32G
3737417,Coles,Ultimate Choc Chip Cookie Baking Mix,500g,5.0,0.0,COLES ULTIMATE CHOC CHIP COOKIE BAKING MIX 500GRAM
3739310,Red Tractor,Wheat Free Omega 3 Oats,500g,7.5,0.0,RED TRACTOR WHEAT FREE OMEGA 3 OATS:500GRAM
3739718,Laoganma,Chilli Sauce With Diced Chicken,210g,4.6,0.0,LAOGANMA CHILLI SAUCE CHICKEN 210G
3739809,Pandaroo,Sweet Condensed Coconut Milk,320g,5.2,0.0,PANDAROO SWEET CONDENSED COCONUT MILK 320G
3740080,Pandaroo,Mung Bean,375g,2.8,0.0,PANDAROO MUNG BEAN 375G
3740615,Glico Pocky,Chocolate Value Pack,176g,7.5,0.0,GLICO POCKY CHOCOLATE VALUE PACK 176G
3740626,Glico Pocky,Strawberry Value Pack,168g,7.5,0.0,GLICO POCKY STRAWBERRY VALUE PACK 168G
3740783,Cucina Matese,Traditional Passata,700g,3.5,0.0,CUCINA MATESE TRADITIONAL PASSATA
3740808,Cucina,Matese Pizza Sauce,350g,,,CUCINA MATESE PIZZA SAUCE
3741152,Ajishima,Japanese Instant Miso Soup Fried Tofu 2 Pack,12g,3.1,0.0,AJISHIMA JAPANESE INSTANT MISO SOUP WITH FRIED TOFU 2PK 12G
3741196,Yoosh,Lychee Flavour Aloe Vera Drink,1.5L,5.45,0.0,YOOSH ALOE VERA DRINK LYCHEE 1.5L
3741980,Vegemite,40% Salt Reduced,235g,5.7,0.0,VEGEMITE 40% SALT REDUCED 235G
3742520,Pico,Salted Caramel Chocolate,80g,9.0,0.0,PICO VEGAN ORGANIC CHOCOLATE SALTED CARAMEL 80G
3743544,Hapi,Dry Roasted Edamame With Sea Salt,100g,2.75,0.0,HAPI DRY ROASTED EDAMAME WITH SEA SALT 100G
3745437,Coles,Mussels In Oil,85g,1.7,0.0,COLES MUSSELS IN OIL
3747487,The Maple Treat,Pure Canadian Maple Syrup,1L,22.0,0.0,MAPLE TREAT PURE CANADIAN MAPLE SYRUP
3748672,Musashi,P30 High Protein Powder Chocolate Milkshake,900g,75.0,0.0,MUSASHI P30 HIGH PROTEIN POWDER CHOCOLATE MILKSHAKE 900G
3748694,Musashi,P30 High Protein Powder Vanilla Milkshake,900g,75.0,0.0,MUSASHI P30 HIGH PROTEIN POWDER VANILLA MILKSHAKE 900G
3748800,Coles,Pink Salt Grinder,250g,6.5,0.0,COLES PINK SALT GRINDER 250G
3748821,Coles,Sea Salt Grinder,250g,6.5,0.0,COLES SEA SALT GRINDER 250G
