prodid,brand,name,size,current_price,full_price,raw_description
6397712,Roses,Marmalade Jam,375g,4.3,0,ROSES SWEET ORANGE MARMALADE JAM 375G
6398023,Kellogg's,Pop Tarts Frosted Strawberry Flavour 8 Toaster Pastries,384g,7.0,0,KELLOGG'S POP TARTS FROSTED STRAWBERRY FLAVOUR 8 TOASTER PASTRIES 384G
6410606,Pana Organic,Dark Choc Peanut Caramel Snack Bar,40g,4.5,0,PANA ORGANIC SNACK BAR DARK CHOC PEANUT & CARAMEL 40G
6410617,Pana Organic,Dark Choc Cherry Coconut Snack Bar,40g,4.5,0,PANA ORGANIC SNACK BAR DARK CHOC CHERRY & COCONUT 40G
6413681,Coles Made Easy,Beef Stroganoff With Creamy Sauce,500g,13.0,0,COLES MADE EASY BEEF STROGANOFF WITH CREAMY SAUCE 500G
6415064,Robert Timms,Decaffeinated Coffee Bags 105g,18 pack,10.0,0,ROBERT TIMMS COFFEE BAGS DECAF 105G 18 PACK
6420927,MasterFoods,Tomato Relish,250g,4.5,0,MASTERFOODS CAFE RELISH:.:TOMATO:250 GRAM
6432019,Betty Crocker,Frosted Chocolate Brownie Mix,500g,7.0,0,BETTY CROCKER FROSTED BROWNIE:.:CHOCOLATE:500 GRAM
6433306,A+ Hosan,Original Seaweed Snack,4g,1.0,0,A+ HOSAN ORIGINAL SEAWEED SNACK 4G
6435786,Vege,Vegan Prawn Crackers Sea Salt,75g,4.5,0,VEGE VEGAN PRAWN CRACKERS SEA SALT 75G
6437475,Tasti,Smooshed Dark Cacao Brownie Protein Balls,174g,7.5,0,TASTI SMOOSHED PROTEIN BALLS DARK CACAO BROWNIE 174G
6447480,Keep It Cleaner,Lentil Chips Sea Salt,90g,5.9,0,KEEP IT CLEANER LENTIL CHIPS SEA SALT 90G
6448198,Keep It Cleaner,Lentil Chips Sea Salt & Roast Garlic,90g,5.9,0,KEEP IT CLEANER LENTIL CHIPS SEA SALT & ROAST GARLIC 90G
6467498,Chang's,Crunchy Fried Noodles,100g,1.9,0,CHANG'S CRUNCHY FRIED NOODLES 100G
6475587,Mama,Noodle Chicken 5 Pack,450g,7.0,0,MAMA NOODLE CHICKEN 5PACK 450G
6475598,Mama,Noodle Shrimp Tomyum 5 Pack,450g,7.0,0,MAMA NOODLE SHRIMP TOMYUM 5 PACK 450G
6475601,Mama,Noodle Pork 5 Pack,450g,7.0,0,MAMA NOODLE PORK 5PACK 450G
6476375,Hamper,Original Corned Beef,454g,9.5,0,HAMPER CORNED BEEF ORIGINAL
6494628,Australia's Own,Cream Whipping UHT,250mL,3.2,0,AUSTRALIA'S OWN UHT CREAM 250ML
6495391,Daley Street,Freeze Dried Instant Coffee,100g,6.0,9,DALEY STREET FREEZE DRIED INSTANT COFFEE 100G
6499745,Best Foods,Real Mayonnaise,405g,6.5,0,BEST FOODS MAYONNAISE:REAL:.:405 GRAM
6510746,Passage To India,Extra Spicy Butter Chicken Simmer Sauce,375g,6.3,0,PASSAGE TO INDIA EXTRA SPICY BUTTER CHICKEN SIMMER SAUCE 375G
6510757,Passage To India,Butter Chicken Curry Paste,150g,3.7,0,PASSAGE TO INDIA BUTTER CHICKEN CURRY PASTE 150G
6510815,Passage To India,Korma Curry Paste,150g,3.7,0,PASSAGE TO INDIA KORMA CURRY PASTE 150G
6522938,Coles Simply,Classic Tomato Pasta Sauce,510g,1.8,0,COLES SIMPLY CLASSIC TOMATO PASTA SAUCE 510G
6522950,Coles Simply,Pasta Sauce Caramelised Onion & Garlic,510g,1.8,0,COLES SIMPLY PASTA SAUCE CARAMELISED ONION & GARLIC 510G
6522993,Coles Simply,Tomato & Basil Pasta Sauce,510g,1.8,0,COLES SIMPLY TOMATO & BASIL PASTA SAUCE 510G
6523227,Sunrice,Mini Bites Surfin Sea Salt 6 Pack,108g,5.0,0,SUNRICE MINI BITES SURFIN SEA SLAT 6 PACK 108G
6523238,Sunrice,Mini Bites Mixin Cheese 6 Pack,120g,5.0,0,SUNRICE MINI BITES MIXIN CHEESE 6 PACK 120G
6523249,Sunrice,Mini Bites Rockin Chicken 6 Pack,120g,5.0,0,SUNRICE MINI BITES ROCKIN CHICKEN 6 PACK 120G
6523250,Sunrice,Mini Bites Rollin Salt & Vinegar 6 Pack,120g,5.0,0,SUNRICE MINI BITES ROLLIN SALT & VINEGAR 6 PACK 120G
6526123,Jack Link's,Original Beef Jerky,50g,6.3,0,JACK LINKS BEEF JERKY:ORIGINAL:.:50 GRAM
6526134,Jack Link's,Teriyaki Beef Jerky,50g,6.3,0,JACK LINKS BEEF JERKY:TERIYAKI:.:50 GRAM
6541105,S&W,Gluten Free Whole Egg Mayonnaise,320g,6.0,0,S & W SQUEEZE MAYONNAISE:WHOLE EGG:.:320 GRAM
6542560,Cucina,Matese Tipo 00 Extra Fine Flour,1kg,3.5,0,CUCINA MATESE TIPO 00 EXTRA FINE FLOUR 1KG
6542673,Cucina,Matese Semolina Pure Durum Wheat,1kg,3.5,0,CUCINA MATESE SEMOLINA PURE DURUM WHEAT 1KG
6542822,Saxa,Iodised Table Salt Shaker,125g,2.8,0,SAXA IODISED TALBE SALT SHAKER 125G
6542902,La Espanola,Extra Virgin Olive Oil,4L,55.0,0,LA ESPANOLA EXTRA VIRGIN OLIVE OIL 4 LITRE
6545365,Kras,Hazelnut Nougat Wafers,93g,1.9,0,KRAS HAZELNUT NOUGAT WAFERS 93G
6545387,Kras,Chocolate Cream Wafers,93g,1.9,0,KRAS CHOCOLATE CREAM WAFERS 93G
6545762,Sunrice,Microwave Basmati Rice Pouch,450g,4.5,0,SUNRICE MICROWAVE BASMATI RICE POUCH 450G
6545773,Sunrice,Microwave Brown Rice Pouch,450g,4.5,0,SUNRICE MICROWAVE BROWN RICE POUCH  450G
6545784,Sunrice,Microwave Long Grain Rice Pouch,450g,4.5,0,SUNRICE MICROWAVE LONG GRAIN RICE POUCH 450G
6551211,Coles,Apple Sauce,375g,2.0,0,COLES SAUCE APPLE:APPLE:.:375 GRAM
6551313,Coles,Mint Jelly,300g,1.8,0,COLES MINT JELLY:MINT JELLY:.:300 GRAM
6576449,Whole Earth,Blue Agave Sweetner Raw,330g,7.0,0,WHOLE EARTH BLUE AGAVE SWEETNER RAW 330G
6578820,Whole Earth,Sweetner Monkfruit White Canister,500g,16.0,0,WHOLE EARTH SWEETNER MONKFRUIT WHITE CANISTER 500G
6580901,Hong Gong,Mixed Nuts Mooncake,750g,24.8,0,HONG GONG MIXED NUTS MOONCAKE 750G
