prodid,brand,name,size,current_price,full_price,raw_description
7414249,Coles Pork Ribs Sticky,Sticky American Bbq Glaze,approx. 1kg,22.0,0.0,COLES PORK RIBS WITH STICKY AMERICAN BBQ SAUCE
7428265,Coles Deli,RSPCA Approved Chicken Nibbles Honey Soy,approx. 70g,0.63,0.0,D/L COLES RSPCA APPROVED CHICKEN NIBBLES HONEY SOY
7438338,Coles Made Easy,Slow Cooked Pork Ribs In Bbq Sauce,650g,14.5,0.0,COLES MADE EASY SLOW COOKED PORK RIBS IN BBQ SAUCE 650G
7580190,Coles Simply,Thin Bbq Sausages,560g,5.0,0.0,COLES SIMPLY THIN BBQ SAUSAGES 560G
7607184,Lilydale,Free Range Whole Chicken,approx. 1.27kg each,10.79,0.0,LILYDALE FREE RANGE CHICKEN WHOLE
7677408,Drovers,Big Pack Value Beef Mince,2kg,23.0,0.0,DROVERS BIG PACK VALUE BEEF MINCE 2KG
7677419,Drovers,Diced Casserole,500g,11.0,0.0,DROVERS DICED CASSEROLE 500G
7690767,Moira Mac's,Smoked Chicken Breast,300g,8.5,0.0,MOIRA MAC'S SMOKED CHICKEN BREAST 300G
7703370,Coles,RSPCA Approved Chicken Tropical Bites With Bacon & Pineapple,430g,8.0,0.0,COLES RSPCA CHICKEN TROPICAL BITES WITH BACON AND PINEAPPLE
7820986,Coles,Beef Slow Cook Chuck Roast,approx. 1.3kg,24.7,0.0,COLES BEEF SLOW COOK CHUCK ROAST
7847949,Coles Made Easy,Slow Cooked Teriyaki Chicken,700g,14.0,0.0,COLES MADE EASY SLOW COOKED TERIYAKI CHICKEN 700G
7848420,Coles Made Easy,Slow Cooked Pork Belly Bites In Bbq Honey,500g,14.0,0.0,COLES MADE EASY SLOW COOKED  PORK BELLY BITES IN BBQ HONEY500G
7868053,Coles,Lamb Rump Roast 2pack,approx. 480g,10.56,0.0,COLES LAMB RUMP ROAST 2PK PER KG
7868097,Coles,Graze Lamb Leg Steak 2pack,270g,10.0,0.0,COLES GRAZE LAMB LEG STEAK 2PK:270 GRAM
7876936,Coles,Lamb Ribs With Sticky BBQ Rub,750g,16.5,0.0,COLES LAMB RIBS WITH STICKY BBQ RUB 750G
7991457,Huon,Premium Tasmanian Salmon Steak Skin On 200g,200g,12.0,0.0,HUON PREMIUM TASMANIAN SALMON STEAK SKIN ON 200G
8018520,Tassal,Salmon Family Bundle,460g,15.0,0.0,TASSAL SALMON FAMILY BUNDLE 460G
8094482,Fresh,Whole Rainbow Trout,PERKG,21.0,0.0,DELI FRESH WHOLE RAINBOW TROUT
8104860,Coles Deli,Fresh Tasmanian Salmon Portions Skin Off,approx. 250g,11.5,0.0,COLES DELI FRESH TASMANIAN SALMON PORTIONS SKIN OFF
8112449,Coles,No Added Hormone Beef 4 Star Lean Mince,500g,9.5,0.0,COLES BRAND NO ADDED HORMONE BEEF 4 STAR LEAN MINCE 500 GRAM
8112799,Coles,No Added Hormone Beef 5 Star Extra Trim Mince,500g,10.0,0.0,COLES BRAND NO ADDED HORMONE BEEF  5 STAR EXTRA TRIM MINCE
8407613,Coles,RSPCA Approved Free Range Chicken Mango & Coconut,900g,16.0,0.0,COLES FREE RANGE RSPCA CHICKEN MANGO & COCONUT
8407624,Coles,Free Range RSPCA Chicken Peri Peri,900g,16.0,0.0,COLES FREE RANGE RSPCA CHICKEN PERI PERI
8407646,Coles,Free Range RSPCA Chicken Sweet Mustard Breast Fillet,500g,12.0,0.0,COLES FREE RANGE RSPCA CHICKEN SWEET MUSTARD BREAST FILLET
8409153,Coles,Free Range RSPCA Chicken Leg Fillet Tikka,600g,12.0,0.0,COLES FREE RANGE RSPCA CHICKEN LEG FILLET TIKKA
8409200,Lilydale,Free Range Butterflied Boneless Chicken Rustic Italian Glaze,1.1KG,19.0,0.0,LILYDALE FREE RANGE BUTTERFLIED BONELESS CHICKEN RUSTIC ITALIAN GLAZE
8413831,Cleavers Organic,Lamb Leg Roast Half,approx. 1.6kg,28.8,0.0,CLEAVERS ORGANIC LAMB LEG ROAST HALF
8574309,Coles,Pork 3 Star Regular Mince,800g,8.0,0.0,COLES PORK 3 STAR REGULAR MINCE 800G
8601456,Coles,Beef Blade Roast,approx. 1.55kg,21.7,24.8,COLES BRAND RR 7X5 BEEF BLADE ROAST:PER KG
8648610,Coles,Beef Strips With Bulgogi Marinade,500g,12.0,13.0,COLES BEEF STRIPS WITH BULGOGI MARINADE 500GRAM
8648620,Coles Finest,Flat Iron Sharing Steak With Chilli & Garlic Butter,approx. 420g,15.54,0.0,COLES FINEST FLAT IRON SHARING STEAK WITH CHILLI AND GARLIC BUTTER
8698141,Olga's Fine Foods,Chicken Patties,500g,6.3,0.0,OLGAS CHICKEN PATTIES 500GRAM
8749311,Drovers Choice,No Added Hormone Beef Blade Steak,approx. 1.2kg,22.8,0.0,DROVERS CHOICE NO ADDED HORMONE BEEF BLADE STEAKS FT :PER KG
8781132,Coles,5 Star Extra Lean Pork Mince,500g,7.0,0.0,COLES 5 STAR EXTRA LEAN PORK MINCE (9X7)
8781518,Coles,Regular Pork Mince,500g,5.0,6.0,COLES BRAND REGULAR PORK MINCE  (9X7)
8782237,Coles,Pork & Beef 3 Star Regular Mince Bolognese,500g,6.5,0.0,COLES PORK & BEEF 3 STAR REGULAR MINCE BOLOGNESE WA RR 9X7
8846125,Coles,Pink Ling Fillet,200g,10.0,0.0,COLES PINK LING FILLET 200G
8850461,Coles,3 Star Lamb Mince,500g,8.5,0.0,COLES 3 STAR LAMB MINCE (9X7)
8888158,British,Jumbo Angus Burger,600g,12.0,0.0,BRITISH JUMBO ANGUS BURGER 600GRAM
8891389,Small Batch,Angus Beef Sausage With Sea Salt And Cracked Black Pepper,450g,9.5,0.0,SMALL BATCH ANGUS BEEF SAUSAGE WITH SEA SALT AND CRACKED BLACK PEPPER- 450GM
8894423,Peppercorn,Extra Lean Beef Burger,500g,10.0,0.0,PEPPERCORN EXTRA LEAN BEEF BURGERS 500GM
8901165,Ocean Blue,Smoked Salmon,300GRAM,19.0,0.0,OCEAN BLUE SMOKED SALMON 300G
8909349,Huon,Japanese Infusion Salmon Portion,200g,12.0,0.0,HUON JAPANESE FUSION SALMON 200G
8925083,K Roo,Kangaroo Steaks,400g,12.0,0.0,K ROO KANGAROO STEAKS 400GRAM
8946163,Coles,RSPCA Approved Satay Chicken Kebabs 10 Pack,750g,11.5,0.0,COLES RSPCA SATAY CHICKEN KEBABS 10 PACK 750G
9012814,Coles,No Added Hormone Beef 3 Star Regular Mince,500g,7.0,0.0,COLES BRAND NO ADDED HORMONE BEEF 3 STAR REGULAR MINCE 500 GRAM
9012825,Coles,No Added Hormone Beef 3 Star Regular Mince,1kg,12.0,0.0,COLES BRAND NO ADDED HORMONE BEEF 3 STAR REGULAR MINCE 1 KG
9038410,Skull Island Raw,Giant Tiger Prawns,PERKG,45.0,0.0,MSC SKULL ISLAND RAW GIANT TIGER PRAWNS PER KG
